Sentence	Source
D’ògni tanto a cianzeiva.	DEIZE, Council for Ligurian Linguistic Heritage, 2019-2023, https://conseggio-ligure.org/en/dictionary/deize/
Dâ a benediçion à unna cösa.	DEIZE, Council for Ligurian Linguistic Heritage, 2019-2023, https://conseggio-ligure.org/en/dictionary/deize/
Dâ a boñaneutte.	DEIZE, Council for Ligurian Linguistic Heritage, 2019-2023, https://conseggio-ligure.org/en/dictionary/deize/
Dâ a còrda a-o lumme.	DEIZE, Council for Ligurian Linguistic Heritage, 2019-2023, https://conseggio-ligure.org/en/dictionary/deize/
Dâ a còrda a-o releuio.	DEIZE, Council for Ligurian Linguistic Heritage, 2019-2023, https://conseggio-ligure.org/en/dictionary/deize/
Dâ a diaña.	DEIZE, Council for Ligurian Linguistic Heritage, 2019-2023, https://conseggio-ligure.org/en/dictionary/deize/
Dâ a mente a-i figgeu.	DEIZE, Council for Ligurian Linguistic Heritage, 2019-2023, https://conseggio-ligure.org/en/dictionary/deize/
Dà a mente de no cazze!	DEIZE, Council for Ligurian Linguistic Heritage, 2019-2023, https://conseggio-ligure.org/en/dictionary/deize/
Dâ a-e mosche.	DEIZE, Council for Ligurian Linguistic Heritage, 2019-2023, https://conseggio-ligure.org/en/dictionary/deize/
Dâ bon conto da sò persoña.	DEIZE, Council for Ligurian Linguistic Heritage, 2019-2023, https://conseggio-ligure.org/en/dictionary/deize/
Da chì à un pö semmo à casa.	DEIZE, Council for Ligurian Linguistic Heritage, 2019-2023, https://conseggio-ligure.org/en/dictionary/deize/
Dâ da beive a-e ciante.	DEIZE, Council for Ligurian Linguistic Heritage, 2019-2023, https://conseggio-ligure.org/en/dictionary/deize/
Dâ da beive a-e pegoe.	DEIZE, Council for Ligurian Linguistic Heritage, 2019-2023, https://conseggio-ligure.org/en/dictionary/deize/
Dâ de baccæ inte l’ægua.	DEIZE, Council for Ligurian Linguistic Heritage, 2019-2023, https://conseggio-ligure.org/en/dictionary/deize/
Dâ de ciattonæ.	DEIZE, Council for Ligurian Linguistic Heritage, 2019-2023, https://conseggio-ligure.org/en/dictionary/deize/
Dâ de man a-a spassoia.	DEIZE, Council for Ligurian Linguistic Heritage, 2019-2023, https://conseggio-ligure.org/en/dictionary/deize/
Dâ di commandi a-i sordatti.	DEIZE, Council for Ligurian Linguistic Heritage, 2019-2023, https://conseggio-ligure.org/en/dictionary/deize/
Dâ di crii de contentessa.	DEIZE, Council for Ligurian Linguistic Heritage, 2019-2023, https://conseggio-ligure.org/en/dictionary/deize/
Dâ di ponti into zeugo.	DEIZE, Council for Ligurian Linguistic Heritage, 2019-2023, https://conseggio-ligure.org/en/dictionary/deize/
Dâ e boñe feste.	DEIZE, Council for Ligurian Linguistic Heritage, 2019-2023, https://conseggio-ligure.org/en/dictionary/deize/
Dâ i sò recatti à unna persoña.	DEIZE, Council for Ligurian Linguistic Heritage, 2019-2023, https://conseggio-ligure.org/en/dictionary/deize/
Dâ in cogge.	DEIZE, Council for Ligurian Linguistic Heritage, 2019-2023, https://conseggio-ligure.org/en/dictionary/deize/
Dâ in sciâ voxe.	DEIZE, Council for Ligurian Linguistic Heritage, 2019-2023, https://conseggio-ligure.org/en/dictionary/deize/
Da l’atra banda do sciumme.	DEIZE, Council for Ligurian Linguistic Heritage, 2019-2023, https://conseggio-ligure.org/en/dictionary/deize/
Dâ l’avao à unna longa tradiçion.	DEIZE, Council for Ligurian Linguistic Heritage, 2019-2023, https://conseggio-ligure.org/en/dictionary/deize/
Da largo partio avvardime Dio.	DEIZE, Council for Ligurian Linguistic Heritage, 2019-2023, https://conseggio-ligure.org/en/dictionary/deize/
Dâ leçion.	DEIZE, Council for Ligurian Linguistic Heritage, 2019-2023, https://conseggio-ligure.org/en/dictionary/deize/
Da lettiatua ruscia no ne sò ninte.	DEIZE, Council for Ligurian Linguistic Heritage, 2019-2023, https://conseggio-ligure.org/en/dictionary/deize/
Da maniman s’é fæto indispensabile domandâghe aggiutto.	DEIZE, Council for Ligurian Linguistic Heritage, 2019-2023, https://conseggio-ligure.org/en/dictionary/deize/
Dâ o carreghin.	DEIZE, Council for Ligurian Linguistic Heritage, 2019-2023, https://conseggio-ligure.org/en/dictionary/deize/
Dâ o colpo de graçia.	DEIZE, Council for Ligurian Linguistic Heritage, 2019-2023, https://conseggio-ligure.org/en/dictionary/deize/
Dâ o nomme da-e feste.	DEIZE, Council for Ligurian Linguistic Heritage, 2019-2023, https://conseggio-ligure.org/en/dictionary/deize/
Dâ o resto da parpaggieua.	DEIZE, Council for Ligurian Linguistic Heritage, 2019-2023, https://conseggio-ligure.org/en/dictionary/deize/
Dâ o sbratto à unna persoña.	DEIZE, Council for Ligurian Linguistic Heritage, 2019-2023, https://conseggio-ligure.org/en/dictionary/deize/
Dâ o sfratto à unna persoña.	DEIZE, Council for Ligurian Linguistic Heritage, 2019-2023, https://conseggio-ligure.org/en/dictionary/deize/
Da ògni oa nasce fonzi.	DEIZE, Council for Ligurian Linguistic Heritage, 2019-2023, https://conseggio-ligure.org/en/dictionary/deize/
Da sti mei mæ barba o l’ottëgne un vin ben ben grammo.	DEIZE, Council for Ligurian Linguistic Heritage, 2019-2023, https://conseggio-ligure.org/en/dictionary/deize/
Da sto contræto ne emmo tiou feua un bello guagno.	DEIZE, Council for Ligurian Linguistic Heritage, 2019-2023, https://conseggio-ligure.org/en/dictionary/deize/
Da tutte e bande se sentiva di gren sbraggi.	DEIZE, Council for Ligurian Linguistic Heritage, 2019-2023, https://conseggio-ligure.org/en/dictionary/deize/
Dâ un arregòrdo à unna persoña.	DEIZE, Council for Ligurian Linguistic Heritage, 2019-2023, https://conseggio-ligure.org/en/dictionary/deize/
Da un comme quello no se ghe peu aspëtâ guæi.	DEIZE, Council for Ligurian Linguistic Heritage, 2019-2023, https://conseggio-ligure.org/en/dictionary/deize/
Da un mâ spesso ne nasce un ben.	DEIZE, Council for Ligurian Linguistic Heritage, 2019-2023, https://conseggio-ligure.org/en/dictionary/deize/
Da un momento à l’atro.	DEIZE, Council for Ligurian Linguistic Heritage, 2019-2023, https://conseggio-ligure.org/en/dictionary/deize/
Dâ un strapontin à unna persoña.	DEIZE, Council for Ligurian Linguistic Heritage, 2019-2023, https://conseggio-ligure.org/en/dictionary/deize/
Dâ unna bòtta a-o çercio e l’atra a-a botte.	DEIZE, Council for Ligurian Linguistic Heritage, 2019-2023, https://conseggio-ligure.org/en/dictionary/deize/
Dâ unna scrollâ de spalle.	DEIZE, Council for Ligurian Linguistic Heritage, 2019-2023, https://conseggio-ligure.org/en/dictionary/deize/
Dâ unna smentia à un.	DEIZE, Council for Ligurian Linguistic Heritage, 2019-2023, https://conseggio-ligure.org/en/dictionary/deize/
Dâ unna succâ contra a miagia.	DEIZE, Council for Ligurian Linguistic Heritage, 2019-2023, https://conseggio-ligure.org/en/dictionary/deize/
Da zennâ à arvî.	DEIZE, Council for Ligurian Linguistic Heritage, 2019-2023, https://conseggio-ligure.org/en/dictionary/deize/
Da zoeno portava i speggetti.	DEIZE, Council for Ligurian Linguistic Heritage, 2019-2023, https://conseggio-ligure.org/en/dictionary/deize/
Da-a proa a-a poppa.	DEIZE, Council for Ligurian Linguistic Heritage, 2019-2023, https://conseggio-ligure.org/en/dictionary/deize/
Da-e cattive paghe beseugna sciortîne comme se peu.	DEIZE, Council for Ligurian Linguistic Heritage, 2019-2023, https://conseggio-ligure.org/en/dictionary/deize/
Da-e nòstre bande no ceuve mai.	DEIZE, Council for Ligurian Linguistic Heritage, 2019-2023, https://conseggio-ligure.org/en/dictionary/deize/
Da-e nòstre bande.	DEIZE, Council for Ligurian Linguistic Heritage, 2019-2023, https://conseggio-ligure.org/en/dictionary/deize/
Da-e poule s’é passæ aviou a-i fæti.	DEIZE, Council for Ligurian Linguistic Heritage, 2019-2023, https://conseggio-ligure.org/en/dictionary/deize/
Da-o barcon se vedde a gexa co-o campanin.	DEIZE, Council for Ligurian Linguistic Heritage, 2019-2023, https://conseggio-ligure.org/en/dictionary/deize/
Da-o dito a-o fæto passa un gran træto.	DEIZE, Council for Ligurian Linguistic Heritage, 2019-2023, https://conseggio-ligure.org/en/dictionary/deize/
Da-o marso a-a moffa gh’é pöco da levâ.	DEIZE, Council for Ligurian Linguistic Heritage, 2019-2023, https://conseggio-ligure.org/en/dictionary/deize/
Dæ da beive a-o præve che o cego o l’à sæ.	DEIZE, Council for Ligurian Linguistic Heritage, 2019-2023, https://conseggio-ligure.org/en/dictionary/deize/
Dæ unna man de cô a-a miagia.	DEIZE, Council for Ligurian Linguistic Heritage, 2019-2023, https://conseggio-ligure.org/en/dictionary/deize/
Dagghe un cäso!	DEIZE, Council for Ligurian Linguistic Heritage, 2019-2023, https://conseggio-ligure.org/en/dictionary/deize/
Dâgghe unn’euggiâ quande ti veu.	DEIZE, Council for Ligurian Linguistic Heritage, 2019-2023, https://conseggio-ligure.org/en/dictionary/deize/
Dagghe, mandime o ballon!	DEIZE, Council for Ligurian Linguistic Heritage, 2019-2023, https://conseggio-ligure.org/en/dictionary/deize/
Dâghe un spellinsegon in sciô còllo.	DEIZE, Council for Ligurian Linguistic Heritage, 2019-2023, https://conseggio-ligure.org/en/dictionary/deize/
Dâghe zu un taggio.	DEIZE, Council for Ligurian Linguistic Heritage, 2019-2023, https://conseggio-ligure.org/en/dictionary/deize/
Damme quarche conseggio.	DEIZE, Council for Ligurian Linguistic Heritage, 2019-2023, https://conseggio-ligure.org/en/dictionary/deize/
Danni a mente a-o travaggio, pe piaxei.	DEIZE, Council for Ligurian Linguistic Heritage, 2019-2023, https://conseggio-ligure.org/en/dictionary/deize/
Dapeu o s’é misso torna à dormî co-a pansa piña.	DEIZE, Council for Ligurian Linguistic Heritage, 2019-2023, https://conseggio-ligure.org/en/dictionary/deize/
Davei no ve dæ conto de quello che l’é apreuvo à intravegnî?	DEIZE, Council for Ligurian Linguistic Heritage, 2019-2023, https://conseggio-ligure.org/en/dictionary/deize/
De amixi ghe n’à pe coscì, ghe n’à tanti.	DEIZE, Council for Ligurian Linguistic Heritage, 2019-2023, https://conseggio-ligure.org/en/dictionary/deize/
De che cô o l’é?	DEIZE, Council for Ligurian Linguistic Heritage, 2019-2023, https://conseggio-ligure.org/en/dictionary/deize/
De chì à doe settemañe.	DEIZE, Council for Ligurian Linguistic Heritage, 2019-2023, https://conseggio-ligure.org/en/dictionary/deize/
De chì à doman.	DEIZE, Council for Ligurian Linguistic Heritage, 2019-2023, https://conseggio-ligure.org/en/dictionary/deize/
De chì no ghe passa mai nisciun.	DEIZE, Council for Ligurian Linguistic Heritage, 2019-2023, https://conseggio-ligure.org/en/dictionary/deize/
De chì se peu trae de leçioin.	DEIZE, Council for Ligurian Linguistic Heritage, 2019-2023, https://conseggio-ligure.org/en/dictionary/deize/
De chì se vedde tutto Zena.	DEIZE, Council for Ligurian Linguistic Heritage, 2019-2023, https://conseggio-ligure.org/en/dictionary/deize/
De cöse pæge no ean mai intravegnue.	DEIZE, Council for Ligurian Linguistic Heritage, 2019-2023, https://conseggio-ligure.org/en/dictionary/deize/
De cöse ti parlavi vëi, intanto che camminavimo?	DEIZE, Council for Ligurian Linguistic Heritage, 2019-2023, https://conseggio-ligure.org/en/dictionary/deize/
De cöse ti parli?	DEIZE, Council for Ligurian Linguistic Heritage, 2019-2023, https://conseggio-ligure.org/en/dictionary/deize/
De d’inte profonditæ do mâ.	DEIZE, Council for Ligurian Linguistic Heritage, 2019-2023, https://conseggio-ligure.org/en/dictionary/deize/
De de chì se vedde un panorama mäveggioso.	DEIZE, Council for Ligurian Linguistic Heritage, 2019-2023, https://conseggio-ligure.org/en/dictionary/deize/
De donde te sciòrtan feua de idee comme sta chì?	DEIZE, Council for Ligurian Linguistic Heritage, 2019-2023, https://conseggio-ligure.org/en/dictionary/deize/
De gambe sottî.	DEIZE, Council for Ligurian Linguistic Heritage, 2019-2023, https://conseggio-ligure.org/en/dictionary/deize/
De legno, de færo.	DEIZE, Council for Ligurian Linguistic Heritage, 2019-2023, https://conseggio-ligure.org/en/dictionary/deize/
De mæ amighe, ghe n’é quarcheduña ch’a l’à piggiou a laurea in matëie scientifiche.	DEIZE, Council for Ligurian Linguistic Heritage, 2019-2023, https://conseggio-ligure.org/en/dictionary/deize/
De marso, chi no peu andâ cäsou vadde descäso, ma chi ê à, no e lasce in cà.	DEIZE, Council for Ligurian Linguistic Heritage, 2019-2023, https://conseggio-ligure.org/en/dictionary/deize/
De mätesdì o pòrta delongo i figgi a-a pisciña.	DEIZE, Council for Ligurian Linguistic Heritage, 2019-2023, https://conseggio-ligure.org/en/dictionary/deize/
De neutte i gatti son bardi.	DEIZE, Council for Ligurian Linguistic Heritage, 2019-2023, https://conseggio-ligure.org/en/dictionary/deize/
De neutte ò beseugno d’unna coverta imbottia.	DEIZE, Council for Ligurian Linguistic Heritage, 2019-2023, https://conseggio-ligure.org/en/dictionary/deize/
De novello tutto é bello, de stagion tutto l’é bon.	DEIZE, Council for Ligurian Linguistic Heritage, 2019-2023, https://conseggio-ligure.org/en/dictionary/deize/
De pei rosso, manco boña a vitella.	DEIZE, Council for Ligurian Linguistic Heritage, 2019-2023, https://conseggio-ligure.org/en/dictionary/deize/
De preuve contra de lê no ghe n’ea.	DEIZE, Council for Ligurian Linguistic Heritage, 2019-2023, https://conseggio-ligure.org/en/dictionary/deize/
De seguo o l’é un di megio zugoei.	DEIZE, Council for Ligurian Linguistic Heritage, 2019-2023, https://conseggio-ligure.org/en/dictionary/deize/
De settembre e d’agosto beivi o vin vegio e lascia stâ o mosto.	DEIZE, Council for Ligurian Linguistic Heritage, 2019-2023, https://conseggio-ligure.org/en/dictionary/deize/
De spesso se gh’allamenta sensa raxon.	DEIZE, Council for Ligurian Linguistic Heritage, 2019-2023, https://conseggio-ligure.org/en/dictionary/deize/
De sprescia no ghe n’é.	DEIZE, Council for Ligurian Linguistic Heritage, 2019-2023, https://conseggio-ligure.org/en/dictionary/deize/
De sta stagion o sô o s’erze assæ fito.	DEIZE, Council for Ligurian Linguistic Heritage, 2019-2023, https://conseggio-ligure.org/en/dictionary/deize/
De tòrti lê o no n’à.	DEIZE, Council for Ligurian Linguistic Heritage, 2019-2023, https://conseggio-ligure.org/en/dictionary/deize/
De vòtte beseugna fâ comme can chi nega.	DEIZE, Council for Ligurian Linguistic Heritage, 2019-2023, https://conseggio-ligure.org/en/dictionary/deize/
De za che t’ê chì, dimme un pö.	DEIZE, Council for Ligurian Linguistic Heritage, 2019-2023, https://conseggio-ligure.org/en/dictionary/deize/
Decidde in sciô campo.	DEIZE, Council for Ligurian Linguistic Heritage, 2019-2023, https://conseggio-ligure.org/en/dictionary/deize/
Defæti, cöse t’aiva dito?	DEIZE, Council for Ligurian Linguistic Heritage, 2019-2023, https://conseggio-ligure.org/en/dictionary/deize/
Defende l’imputou.	DEIZE, Council for Ligurian Linguistic Heritage, 2019-2023, https://conseggio-ligure.org/en/dictionary/deize/
Delongo.	DEIZE, Council for Ligurian Linguistic Heritage, 2019-2023, https://conseggio-ligure.org/en/dictionary/deize/
Deluviâse unna cösa.	DEIZE, Council for Ligurian Linguistic Heritage, 2019-2023, https://conseggio-ligure.org/en/dictionary/deize/
Dente de l’euggio.	DEIZE, Council for Ligurian Linguistic Heritage, 2019-2023, https://conseggio-ligure.org/en/dictionary/deize/
Deprescion de saxon in sciô Mediterraneo de levante.	DEIZE, Council for Ligurian Linguistic Heritage, 2019-2023, https://conseggio-ligure.org/en/dictionary/deize/
Desarrembo e giöxie.	DEIZE, Council for Ligurian Linguistic Heritage, 2019-2023, https://conseggio-ligure.org/en/dictionary/deize/
Descarregâse.	DEIZE, Council for Ligurian Linguistic Heritage, 2019-2023, https://conseggio-ligure.org/en/dictionary/deize/
Desccegæ e veie!	DEIZE, Council for Ligurian Linguistic Heritage, 2019-2023, https://conseggio-ligure.org/en/dictionary/deize/
Desfa o crescente inte l’ægua.	DEIZE, Council for Ligurian Linguistic Heritage, 2019-2023, https://conseggio-ligure.org/en/dictionary/deize/
Despontâse o vestî.	DEIZE, Council for Ligurian Linguistic Heritage, 2019-2023, https://conseggio-ligure.org/en/dictionary/deize/
Destaccâ e patelle da-i scheuggi.	DEIZE, Council for Ligurian Linguistic Heritage, 2019-2023, https://conseggio-ligure.org/en/dictionary/deize/
Destende à l’äia.	DEIZE, Council for Ligurian Linguistic Heritage, 2019-2023, https://conseggio-ligure.org/en/dictionary/deize/
Destende i moscoli.	DEIZE, Council for Ligurian Linguistic Heritage, 2019-2023, https://conseggio-ligure.org/en/dictionary/deize/
Destende unna persoña in sce un canto.	DEIZE, Council for Ligurian Linguistic Heritage, 2019-2023, https://conseggio-ligure.org/en/dictionary/deize/
Deuviâ a miagia pe arrembo.	DEIZE, Council for Ligurian Linguistic Heritage, 2019-2023, https://conseggio-ligure.org/en/dictionary/deize/
Deuviâ tutte e energie che se gh’à inte un progetto.	DEIZE, Council for Ligurian Linguistic Heritage, 2019-2023, https://conseggio-ligure.org/en/dictionary/deize/
Devo attrovâ a mæ machina.	DEIZE, Council for Ligurian Linguistic Heritage, 2019-2023, https://conseggio-ligure.org/en/dictionary/deize/
Devo dâ da beive a-e tomate.	DEIZE, Council for Ligurian Linguistic Heritage, 2019-2023, https://conseggio-ligure.org/en/dictionary/deize/
Devo dâ recatto a-a mæ stançia.	DEIZE, Council for Ligurian Linguistic Heritage, 2019-2023, https://conseggio-ligure.org/en/dictionary/deize/
Devo piggiâ l’examme de latin.	DEIZE, Council for Ligurian Linguistic Heritage, 2019-2023, https://conseggio-ligure.org/en/dictionary/deize/
Dexe meizañe.	DEIZE, Council for Ligurian Linguistic Heritage, 2019-2023, https://conseggio-ligure.org/en/dictionary/deize/
Dexe, neuve, eutto, sette, sëi, çinque, quattro, trei, doî, un, zero.	DEIZE, Council for Ligurian Linguistic Heritage, 2019-2023, https://conseggio-ligure.org/en/dictionary/deize/
Dî in sciô serio ò pe burla?	DEIZE, Council for Ligurian Linguistic Heritage, 2019-2023, https://conseggio-ligure.org/en/dictionary/deize/
Dî mâ comme de strasse de unna persoña.	DEIZE, Council for Ligurian Linguistic Heritage, 2019-2023, https://conseggio-ligure.org/en/dictionary/deize/
Dî röba da ciödi.	DEIZE, Council for Ligurian Linguistic Heritage, 2019-2023, https://conseggio-ligure.org/en/dictionary/deize/
Di sciummi d’inciòstro.	DEIZE, Council for Ligurian Linguistic Heritage, 2019-2023, https://conseggio-ligure.org/en/dictionary/deize/
Dî tutto o ben do mondo de unna persoña.	DEIZE, Council for Ligurian Linguistic Heritage, 2019-2023, https://conseggio-ligure.org/en/dictionary/deize/
Dî un mondo de villanie à unna persoña.	DEIZE, Council for Ligurian Linguistic Heritage, 2019-2023, https://conseggio-ligure.org/en/dictionary/deize/
Dî unna cösa in sciâ faccia.	DEIZE, Council for Ligurian Linguistic Heritage, 2019-2023, https://conseggio-ligure.org/en/dictionary/deize/
Dî unna cösa in sciô moro.	DEIZE, Council for Ligurian Linguistic Heritage, 2019-2023, https://conseggio-ligure.org/en/dictionary/deize/
Di zoeni an occupou unna casa despixonâ.	DEIZE, Council for Ligurian Linguistic Heritage, 2019-2023, https://conseggio-ligure.org/en/dictionary/deize/
Diæ che l’é arrivou l’oa de partî.	DEIZE, Council for Ligurian Linguistic Heritage, 2019-2023, https://conseggio-ligure.org/en/dictionary/deize/
Dibattî in sce un argomento.	DEIZE, Council for Ligurian Linguistic Heritage, 2019-2023, https://conseggio-ligure.org/en/dictionary/deize/
Diggo mâ ò t’æ misso sciù da grascia?	DEIZE, Council for Ligurian Linguistic Heritage, 2019-2023, https://conseggio-ligure.org/en/dictionary/deize/
Dinni pe primma cösa comme t’acciammi.	DEIZE, Council for Ligurian Linguistic Heritage, 2019-2023, https://conseggio-ligure.org/en/dictionary/deize/
Dinni un dexidëio!	DEIZE, Council for Ligurian Linguistic Heritage, 2019-2023, https://conseggio-ligure.org/en/dictionary/deize/
Dinni un dexio!	DEIZE, Council for Ligurian Linguistic Heritage, 2019-2023, https://conseggio-ligure.org/en/dictionary/deize/
Dio n’avvarde!	DEIZE, Council for Ligurian Linguistic Heritage, 2019-2023, https://conseggio-ligure.org/en/dictionary/deize/
Dipende da-a voentæ de unna persoña.	DEIZE, Council for Ligurian Linguistic Heritage, 2019-2023, https://conseggio-ligure.org/en/dictionary/deize/
Discorrimmo d’euve che l’é chì Pasqua.	DEIZE, Council for Ligurian Linguistic Heritage, 2019-2023, https://conseggio-ligure.org/en/dictionary/deize/
Discorsci ciatti.	DEIZE, Council for Ligurian Linguistic Heritage, 2019-2023, https://conseggio-ligure.org/en/dictionary/deize/
Disegnâ unna sciô, un erbo.	DEIZE, Council for Ligurian Linguistic Heritage, 2019-2023, https://conseggio-ligure.org/en/dictionary/deize/
Dïsette citti.	DEIZE, Council for Ligurian Linguistic Heritage, 2019-2023, https://conseggio-ligure.org/en/dictionary/deize/
Dispoñe i figgeu inte unna fia.	DEIZE, Council for Ligurian Linguistic Heritage, 2019-2023, https://conseggio-ligure.org/en/dictionary/deize/
Disputâ de l’ombra de l’ase.	DEIZE, Council for Ligurian Linguistic Heritage, 2019-2023, https://conseggio-ligure.org/en/dictionary/deize/
Dixan che o coccodrillo o se mangia i òmmi e dapeu o cianze.	DEIZE, Council for Ligurian Linguistic Heritage, 2019-2023, https://conseggio-ligure.org/en/dictionary/deize/
Dixe a figgia de Torriggia, chi veu tutto ninte piggia.	DEIZE, Council for Ligurian Linguistic Heritage, 2019-2023, https://conseggio-ligure.org/en/dictionary/deize/
Dixineuve vòtte a-o meise.	DEIZE, Council for Ligurian Linguistic Heritage, 2019-2023, https://conseggio-ligure.org/en/dictionary/deize/
Do fæto sò ognun peu fâne quello ch’o veu.	DEIZE, Council for Ligurian Linguistic Heritage, 2019-2023, https://conseggio-ligure.org/en/dictionary/deize/
Doa mia sëi çento sciusciant’e doî.	DEIZE, Council for Ligurian Linguistic Heritage, 2019-2023, https://conseggio-ligure.org/en/dictionary/deize/
Doçe comme l’abbrasso d’unna dònna.	DEIZE, Council for Ligurian Linguistic Heritage, 2019-2023, https://conseggio-ligure.org/en/dictionary/deize/
Doe ancioe averte.	DEIZE, Council for Ligurian Linguistic Heritage, 2019-2023, https://conseggio-ligure.org/en/dictionary/deize/
Doe magnæ de fæña.	DEIZE, Council for Ligurian Linguistic Heritage, 2019-2023, https://conseggio-ligure.org/en/dictionary/deize/
Doe peie.	DEIZE, Council for Ligurian Linguistic Heritage, 2019-2023, https://conseggio-ligure.org/en/dictionary/deize/
Doe vacche.	DEIZE, Council for Ligurian Linguistic Heritage, 2019-2023, https://conseggio-ligure.org/en/dictionary/deize/
Doggiâ o fî da scheña.	DEIZE, Council for Ligurian Linguistic Heritage, 2019-2023, https://conseggio-ligure.org/en/dictionary/deize/
Doî bollettin da tiatro.	DEIZE, Council for Ligurian Linguistic Heritage, 2019-2023, https://conseggio-ligure.org/en/dictionary/deize/
Doî chen.	DEIZE, Council for Ligurian Linguistic Heritage, 2019-2023, https://conseggio-ligure.org/en/dictionary/deize/
Doî euro e dixeutto citti.	DEIZE, Council for Ligurian Linguistic Heritage, 2019-2023, https://conseggio-ligure.org/en/dictionary/deize/
Doman à sëi oe ò un incontro de travaggio.	DEIZE, Council for Ligurian Linguistic Heritage, 2019-2023, https://conseggio-ligure.org/en/dictionary/deize/
Doman emmo l’examme de filosofia.	DEIZE, Council for Ligurian Linguistic Heritage, 2019-2023, https://conseggio-ligure.org/en/dictionary/deize/
Doman gh’é a diaña à l’arba.	DEIZE, Council for Ligurian Linguistic Heritage, 2019-2023, https://conseggio-ligure.org/en/dictionary/deize/
Doman vaggo à un nataliçio.	DEIZE, Council for Ligurian Linguistic Heritage, 2019-2023, https://conseggio-ligure.org/en/dictionary/deize/
Domandâ indicaçioin à unna persoña.	DEIZE, Council for Ligurian Linguistic Heritage, 2019-2023, https://conseggio-ligure.org/en/dictionary/deize/
Domenega ch’a vëgne.	DEIZE, Council for Ligurian Linguistic Heritage, 2019-2023, https://conseggio-ligure.org/en/dictionary/deize/
Domenega passâ.	DEIZE, Council for Ligurian Linguistic Heritage, 2019-2023, https://conseggio-ligure.org/en/dictionary/deize/
Donca, fæme pensâ.	DEIZE, Council for Ligurian Linguistic Heritage, 2019-2023, https://conseggio-ligure.org/en/dictionary/deize/
Dond’a l’é a coxiña?	DEIZE, Council for Ligurian Linguistic Heritage, 2019-2023, https://conseggio-ligure.org/en/dictionary/deize/
Dond’a l’é a preisa da luxe?	DEIZE, Council for Ligurian Linguistic Heritage, 2019-2023, https://conseggio-ligure.org/en/dictionary/deize/
Dond’a l’é l’intrâ do giardin?	DEIZE, Council for Ligurian Linguistic Heritage, 2019-2023, https://conseggio-ligure.org/en/dictionary/deize/
Dond’o l’é o tò senso d’avventua?	DEIZE, Council for Ligurian Linguistic Heritage, 2019-2023, https://conseggio-ligure.org/en/dictionary/deize/
Dond’o pòrta sto sentê?	DEIZE, Council for Ligurian Linguistic Heritage, 2019-2023, https://conseggio-ligure.org/en/dictionary/deize/
Donde l’é ch’a l’à misso l’ægua santa?	DEIZE, Council for Ligurian Linguistic Heritage, 2019-2023, https://conseggio-ligure.org/en/dictionary/deize/
Donde l’é finio e ciave da machina?	DEIZE, Council for Ligurian Linguistic Heritage, 2019-2023, https://conseggio-ligure.org/en/dictionary/deize/
Donde t’æ infricciou e fotografie?	DEIZE, Council for Ligurian Linguistic Heritage, 2019-2023, https://conseggio-ligure.org/en/dictionary/deize/
Dònna de ciassa.	DEIZE, Council for Ligurian Linguistic Heritage, 2019-2023, https://conseggio-ligure.org/en/dictionary/deize/
Dònna, cavallo e barca, son de chi ê cavarca.	DEIZE, Council for Ligurian Linguistic Heritage, 2019-2023, https://conseggio-ligure.org/en/dictionary/deize/
Dònna, succa e çioula a n’é graçia de Dio.	DEIZE, Council for Ligurian Linguistic Heritage, 2019-2023, https://conseggio-ligure.org/en/dictionary/deize/
Dònne, scciuppette e libbri no se ne presta à nisciun.	DEIZE, Council for Ligurian Linguistic Heritage, 2019-2023, https://conseggio-ligure.org/en/dictionary/deize/
