Sentence	Source
Me despiaxe!	DEIZE, Council for Ligurian Linguistic Heritage, 2019-2023, https://conseggio-ligure.org/en/dictionary/deize/
Me deue quande gio a testa.	DEIZE, Council for Ligurian Linguistic Heritage, 2019-2023, https://conseggio-ligure.org/en/dictionary/deize/
Me ghe vorian dötrei giorni pe fâlo.	DEIZE, Council for Ligurian Linguistic Heritage, 2019-2023, https://conseggio-ligure.org/en/dictionary/deize/
Me gratto donde me smangia.	DEIZE, Council for Ligurian Linguistic Heritage, 2019-2023, https://conseggio-ligure.org/en/dictionary/deize/
Me gusta i spòrt estremi.	DEIZE, Council for Ligurian Linguistic Heritage, 2019-2023, https://conseggio-ligure.org/en/dictionary/deize/
Me lasciæ sciortî staseia?	DEIZE, Council for Ligurian Linguistic Heritage, 2019-2023, https://conseggio-ligure.org/en/dictionary/deize/
Me mäveggio che ti me dixi coscì.	DEIZE, Council for Ligurian Linguistic Heritage, 2019-2023, https://conseggio-ligure.org/en/dictionary/deize/
Me metto à scrive a mæ memöia.	DEIZE, Council for Ligurian Linguistic Heritage, 2019-2023, https://conseggio-ligure.org/en/dictionary/deize/
Me n’indubito.	DEIZE, Council for Ligurian Linguistic Heritage, 2019-2023, https://conseggio-ligure.org/en/dictionary/deize/
Me n’ò ascordou.	DEIZE, Council for Ligurian Linguistic Heritage, 2019-2023, https://conseggio-ligure.org/en/dictionary/deize/
Me ne vaggo à cà.	DEIZE, Council for Ligurian Linguistic Heritage, 2019-2023, https://conseggio-ligure.org/en/dictionary/deize/
Me ne vaggo unna vòtta pe tutte.	DEIZE, Council for Ligurian Linguistic Heritage, 2019-2023, https://conseggio-ligure.org/en/dictionary/deize/
Me pâ che segge l’oa de çenâ.	DEIZE, Council for Ligurian Linguistic Heritage, 2019-2023, https://conseggio-ligure.org/en/dictionary/deize/
Me pâ d’ëse renasciuo.	DEIZE, Council for Ligurian Linguistic Heritage, 2019-2023, https://conseggio-ligure.org/en/dictionary/deize/
Me pâ d’ëse vegnua torna zoena.	DEIZE, Council for Ligurian Linguistic Heritage, 2019-2023, https://conseggio-ligure.org/en/dictionary/deize/
Me pâ de scì.	DEIZE, Council for Ligurian Linguistic Heritage, 2019-2023, https://conseggio-ligure.org/en/dictionary/deize/
Me paiva ciæo che me voësan parlâ.	DEIZE, Council for Ligurian Linguistic Heritage, 2019-2023, https://conseggio-ligure.org/en/dictionary/deize/
Me rincresce, ma sto vestî o l’é camoou.	DEIZE, Council for Ligurian Linguistic Heritage, 2019-2023, https://conseggio-ligure.org/en/dictionary/deize/
Me rincresce!	DEIZE, Council for Ligurian Linguistic Heritage, 2019-2023, https://conseggio-ligure.org/en/dictionary/deize/
Me saieiva cao ch’a vegnisse un pö ciù indipendente.	DEIZE, Council for Ligurian Linguistic Heritage, 2019-2023, https://conseggio-ligure.org/en/dictionary/deize/
Me saieiva cao mette un poster in sciâ pòrta da mæ stançia.	DEIZE, Council for Ligurian Linguistic Heritage, 2019-2023, https://conseggio-ligure.org/en/dictionary/deize/
Me serviæ o vòstro aggiutto.	DEIZE, Council for Ligurian Linguistic Heritage, 2019-2023, https://conseggio-ligure.org/en/dictionary/deize/
Me son addesciou à l’ospiâ.	DEIZE, Council for Ligurian Linguistic Heritage, 2019-2023, https://conseggio-ligure.org/en/dictionary/deize/
Me son addesciou co-i euggi bollæ.	DEIZE, Council for Ligurian Linguistic Heritage, 2019-2023, https://conseggio-ligure.org/en/dictionary/deize/
Me son ascordou d’accattâ o pan.	DEIZE, Council for Ligurian Linguistic Heritage, 2019-2023, https://conseggio-ligure.org/en/dictionary/deize/
Me son ascordou o portafeuggio in scagno.	DEIZE, Council for Ligurian Linguistic Heritage, 2019-2023, https://conseggio-ligure.org/en/dictionary/deize/
Me son assettou inte un canto.	DEIZE, Council for Ligurian Linguistic Heritage, 2019-2023, https://conseggio-ligure.org/en/dictionary/deize/
Me son assunnou che xoava.	DEIZE, Council for Ligurian Linguistic Heritage, 2019-2023, https://conseggio-ligure.org/en/dictionary/deize/
Me son ciù cäi i libbri con tante figue.	DEIZE, Council for Ligurian Linguistic Heritage, 2019-2023, https://conseggio-ligure.org/en/dictionary/deize/
Me son fæto unna pansâ de raieu.	DEIZE, Council for Ligurian Linguistic Heritage, 2019-2023, https://conseggio-ligure.org/en/dictionary/deize/
Me son giusto cangiou de vestî.	DEIZE, Council for Ligurian Linguistic Heritage, 2019-2023, https://conseggio-ligure.org/en/dictionary/deize/
Me son missa unna crovata quaddriggiâ.	DEIZE, Council for Ligurian Linguistic Heritage, 2019-2023, https://conseggio-ligure.org/en/dictionary/deize/
Me son misso a-o sô.	DEIZE, Council for Ligurian Linguistic Heritage, 2019-2023, https://conseggio-ligure.org/en/dictionary/deize/
Me son scrito à l’assoçiaçion.	DEIZE, Council for Ligurian Linguistic Heritage, 2019-2023, https://conseggio-ligure.org/en/dictionary/deize/
Me son scrito à l’universcitæ.	DEIZE, Council for Ligurian Linguistic Heritage, 2019-2023, https://conseggio-ligure.org/en/dictionary/deize/
Me son vestio de neigro da-a testa a-i pê.	DEIZE, Council for Ligurian Linguistic Heritage, 2019-2023, https://conseggio-ligure.org/en/dictionary/deize/
Me treuvo inte unna scituaçion gramma.	DEIZE, Council for Ligurian Linguistic Heritage, 2019-2023, https://conseggio-ligure.org/en/dictionary/deize/
Meistraladda into Canâ de Sardegna.	DEIZE, Council for Ligurian Linguistic Heritage, 2019-2023, https://conseggio-ligure.org/en/dictionary/deize/
Meistro de disegno.	DEIZE, Council for Ligurian Linguistic Heritage, 2019-2023, https://conseggio-ligure.org/en/dictionary/deize/
Meistro-tramontaña.	DEIZE, Council for Ligurian Linguistic Heritage, 2019-2023, https://conseggio-ligure.org/en/dictionary/deize/
Meno fumme e ciù ròsto.	DEIZE, Council for Ligurian Linguistic Heritage, 2019-2023, https://conseggio-ligure.org/en/dictionary/deize/
Meno s’é à töa ciù se mangia.	DEIZE, Council for Ligurian Linguistic Heritage, 2019-2023, https://conseggio-ligure.org/en/dictionary/deize/
Mescciâ o succao rosou co-i bertoeli.	DEIZE, Council for Ligurian Linguistic Heritage, 2019-2023, https://conseggio-ligure.org/en/dictionary/deize/
Meschiña quella cà che de vegio a no sa.	DEIZE, Council for Ligurian Linguistic Heritage, 2019-2023, https://conseggio-ligure.org/en/dictionary/deize/
Meschiña quella pegoa chi no sa avvardâ a sò laña.	DEIZE, Council for Ligurian Linguistic Heritage, 2019-2023, https://conseggio-ligure.org/en/dictionary/deize/
Mesciæve che l’é za seia!	DEIZE, Council for Ligurian Linguistic Heritage, 2019-2023, https://conseggio-ligure.org/en/dictionary/deize/
Mette a ciave inta ciaveuia.	DEIZE, Council for Ligurian Linguistic Heritage, 2019-2023, https://conseggio-ligure.org/en/dictionary/deize/
Mette à færo e à feugo.	DEIZE, Council for Ligurian Linguistic Heritage, 2019-2023, https://conseggio-ligure.org/en/dictionary/deize/
Mette a povie in sciô povien.	DEIZE, Council for Ligurian Linguistic Heritage, 2019-2023, https://conseggio-ligure.org/en/dictionary/deize/
Mette a pugnatta in sciô feugo.	DEIZE, Council for Ligurian Linguistic Heritage, 2019-2023, https://conseggio-ligure.org/en/dictionary/deize/
Mette a sò sampa inte unna cösa.	DEIZE, Council for Ligurian Linguistic Heritage, 2019-2023, https://conseggio-ligure.org/en/dictionary/deize/
Mette a-o ciæo unna persoña de unna cösa.	DEIZE, Council for Ligurian Linguistic Heritage, 2019-2023, https://conseggio-ligure.org/en/dictionary/deize/
Mette a-o passo unna persoña.	DEIZE, Council for Ligurian Linguistic Heritage, 2019-2023, https://conseggio-ligure.org/en/dictionary/deize/
Mette da-a parte.	DEIZE, Council for Ligurian Linguistic Heritage, 2019-2023, https://conseggio-ligure.org/en/dictionary/deize/
Mette de l’euio into lumme.	DEIZE, Council for Ligurian Linguistic Heritage, 2019-2023, https://conseggio-ligure.org/en/dictionary/deize/
Mette dinæ à cangio.	DEIZE, Council for Ligurian Linguistic Heritage, 2019-2023, https://conseggio-ligure.org/en/dictionary/deize/
Mette do tempo à fâ unna cösa.	DEIZE, Council for Ligurian Linguistic Heritage, 2019-2023, https://conseggio-ligure.org/en/dictionary/deize/
Mette e bele a-o còllo.	DEIZE, Council for Ligurian Linguistic Heritage, 2019-2023, https://conseggio-ligure.org/en/dictionary/deize/
Mette i numeri inte unna colònna.	DEIZE, Council for Ligurian Linguistic Heritage, 2019-2023, https://conseggio-ligure.org/en/dictionary/deize/
Mette in capponea.	DEIZE, Council for Ligurian Linguistic Heritage, 2019-2023, https://conseggio-ligure.org/en/dictionary/deize/
Mette in scueuia.	DEIZE, Council for Ligurian Linguistic Heritage, 2019-2023, https://conseggio-ligure.org/en/dictionary/deize/
Mette into curlo un figgeu.	DEIZE, Council for Ligurian Linguistic Heritage, 2019-2023, https://conseggio-ligure.org/en/dictionary/deize/
Mette o pan de Natale in sce unna cösa.	DEIZE, Council for Ligurian Linguistic Heritage, 2019-2023, https://conseggio-ligure.org/en/dictionary/deize/
Mette poia.	DEIZE, Council for Ligurian Linguistic Heritage, 2019-2023, https://conseggio-ligure.org/en/dictionary/deize/
Mette sciù unna famiggia.	DEIZE, Council for Ligurian Linguistic Heritage, 2019-2023, https://conseggio-ligure.org/en/dictionary/deize/
Mette un co-o gancio a-a goa.	DEIZE, Council for Ligurian Linguistic Heritage, 2019-2023, https://conseggio-ligure.org/en/dictionary/deize/
Mette un öxello inte unna gaggia.	DEIZE, Council for Ligurian Linguistic Heritage, 2019-2023, https://conseggio-ligure.org/en/dictionary/deize/
Mette un pollastro into scartòccio.	DEIZE, Council for Ligurian Linguistic Heritage, 2019-2023, https://conseggio-ligure.org/en/dictionary/deize/
Mette unna cösa à seccâ a-o sô.	DEIZE, Council for Ligurian Linguistic Heritage, 2019-2023, https://conseggio-ligure.org/en/dictionary/deize/
Mette xatte e tondi in sciâ töa.	DEIZE, Council for Ligurian Linguistic Heritage, 2019-2023, https://conseggio-ligure.org/en/dictionary/deize/
Mettemmo ch’a no l’agge coæ de vegnî.	DEIZE, Council for Ligurian Linguistic Heritage, 2019-2023, https://conseggio-ligure.org/en/dictionary/deize/
Mettemmo che t’aggi raxon.	DEIZE, Council for Ligurian Linguistic Heritage, 2019-2023, https://conseggio-ligure.org/en/dictionary/deize/
Mettemmose à tiâ unna monæa e ammiemmo chi guägna.	DEIZE, Council for Ligurian Linguistic Heritage, 2019-2023, https://conseggio-ligure.org/en/dictionary/deize/
Metti e poule in ordine alfabetico.	DEIZE, Council for Ligurian Linguistic Heritage, 2019-2023, https://conseggio-ligure.org/en/dictionary/deize/
Mettighe un pan de butiro.	DEIZE, Council for Ligurian Linguistic Heritage, 2019-2023, https://conseggio-ligure.org/en/dictionary/deize/
Mettise à töa con de amighe.	DEIZE, Council for Ligurian Linguistic Heritage, 2019-2023, https://conseggio-ligure.org/en/dictionary/deize/
Mettise in dozzeña.	DEIZE, Council for Ligurian Linguistic Heritage, 2019-2023, https://conseggio-ligure.org/en/dictionary/deize/
Mettise inte moen de unna persoña.	DEIZE, Council for Ligurian Linguistic Heritage, 2019-2023, https://conseggio-ligure.org/en/dictionary/deize/
Mettise o cheu in paxe.	DEIZE, Council for Ligurian Linguistic Heritage, 2019-2023, https://conseggio-ligure.org/en/dictionary/deize/
Mettise o tempo in sciô bon.	DEIZE, Council for Ligurian Linguistic Heritage, 2019-2023, https://conseggio-ligure.org/en/dictionary/deize/
Mettise pe mòrto à fâ unna cösa.	DEIZE, Council for Ligurian Linguistic Heritage, 2019-2023, https://conseggio-ligure.org/en/dictionary/deize/
Mettise, levâse unna rebecca.	DEIZE, Council for Ligurian Linguistic Heritage, 2019-2023, https://conseggio-ligure.org/en/dictionary/deize/
Mettise, mantegnîse in contatto.	DEIZE, Council for Ligurian Linguistic Heritage, 2019-2023, https://conseggio-ligure.org/en/dictionary/deize/
Meuo da-a sæ!	DEIZE, Council for Ligurian Linguistic Heritage, 2019-2023, https://conseggio-ligure.org/en/dictionary/deize/
Mi à lê no ghe parlo.	DEIZE, Council for Ligurian Linguistic Heritage, 2019-2023, https://conseggio-ligure.org/en/dictionary/deize/
Mi beivo l’ægua do bronzin.	DEIZE, Council for Ligurian Linguistic Heritage, 2019-2023, https://conseggio-ligure.org/en/dictionary/deize/
Mi e mæ fræ semmo d’accòrdio in sce tutto.	DEIZE, Council for Ligurian Linguistic Heritage, 2019-2023, https://conseggio-ligure.org/en/dictionary/deize/
Mi gh’ò dito che no ô saiva.	DEIZE, Council for Ligurian Linguistic Heritage, 2019-2023, https://conseggio-ligure.org/en/dictionary/deize/
Mi ghe mettiæ ancon un pö de sâ.	DEIZE, Council for Ligurian Linguistic Heritage, 2019-2023, https://conseggio-ligure.org/en/dictionary/deize/
Mi me ne batto de quello che ti dixi.	DEIZE, Council for Ligurian Linguistic Heritage, 2019-2023, https://conseggio-ligure.org/en/dictionary/deize/
Mi n’ò piaxei.	DEIZE, Council for Ligurian Linguistic Heritage, 2019-2023, https://conseggio-ligure.org/en/dictionary/deize/
Mi no conoscio guæi ben i filòsofi greghi.	DEIZE, Council for Ligurian Linguistic Heritage, 2019-2023, https://conseggio-ligure.org/en/dictionary/deize/
Mi no diggo mâ de nisciun.	DEIZE, Council for Ligurian Linguistic Heritage, 2019-2023, https://conseggio-ligure.org/en/dictionary/deize/
Mi no l’arrezo ciù!	DEIZE, Council for Ligurian Linguistic Heritage, 2019-2023, https://conseggio-ligure.org/en/dictionary/deize/
Mi no ne veuggio manco.	DEIZE, Council for Ligurian Linguistic Heritage, 2019-2023, https://conseggio-ligure.org/en/dictionary/deize/
Mi no parlo ingleise.	DEIZE, Council for Ligurian Linguistic Heritage, 2019-2023, https://conseggio-ligure.org/en/dictionary/deize/
Mi no son unna persoña discreta.	DEIZE, Council for Ligurian Linguistic Heritage, 2019-2023, https://conseggio-ligure.org/en/dictionary/deize/
Mi ò e voxe e i atri an e noxe.	DEIZE, Council for Ligurian Linguistic Heritage, 2019-2023, https://conseggio-ligure.org/en/dictionary/deize/
Mi parlo o ciavæn.	DEIZE, Council for Ligurian Linguistic Heritage, 2019-2023, https://conseggio-ligure.org/en/dictionary/deize/
Mi parlo siçilian.	DEIZE, Council for Ligurian Linguistic Heritage, 2019-2023, https://conseggio-ligure.org/en/dictionary/deize/
Mi son nasciuo a-o primmo de zennâ, mæ seu a l’é nasciua a-i chinze de frevâ.	DEIZE, Council for Ligurian Linguistic Heritage, 2019-2023, https://conseggio-ligure.org/en/dictionary/deize/
Mi, pe contra, son stracco.	DEIZE, Council for Ligurian Linguistic Heritage, 2019-2023, https://conseggio-ligure.org/en/dictionary/deize/
Moî da-a famme	DEIZE, Council for Ligurian Linguistic Heritage, 2019-2023, https://conseggio-ligure.org/en/dictionary/deize/
Moî da-a gioxia	DEIZE, Council for Ligurian Linguistic Heritage, 2019-2023, https://conseggio-ligure.org/en/dictionary/deize/
Moî da-a raggia.	DEIZE, Council for Ligurian Linguistic Heritage, 2019-2023, https://conseggio-ligure.org/en/dictionary/deize/
Moieiva ciù fito a vacca de un pöveo òmmo.	DEIZE, Council for Ligurian Linguistic Heritage, 2019-2023, https://conseggio-ligure.org/en/dictionary/deize/
Mollâ unna còrda.	DEIZE, Council for Ligurian Linguistic Heritage, 2019-2023, https://conseggio-ligure.org/en/dictionary/deize/
Monæa boña.	DEIZE, Council for Ligurian Linguistic Heritage, 2019-2023, https://conseggio-ligure.org/en/dictionary/deize/
Montâ a casa neuva.	DEIZE, Council for Ligurian Linguistic Heritage, 2019-2023, https://conseggio-ligure.org/en/dictionary/deize/
Monta i prexi.	DEIZE, Council for Ligurian Linguistic Heritage, 2019-2023, https://conseggio-ligure.org/en/dictionary/deize/
Montâ in sce l’erbo co-o bäçigo.	DEIZE, Council for Ligurian Linguistic Heritage, 2019-2023, https://conseggio-ligure.org/en/dictionary/deize/
Montâ in sciâ scheña do cavallo.	DEIZE, Council for Ligurian Linguistic Heritage, 2019-2023, https://conseggio-ligure.org/en/dictionary/deize/
Montemmo e scæ.	DEIZE, Council for Ligurian Linguistic Heritage, 2019-2023, https://conseggio-ligure.org/en/dictionary/deize/
Montemmo in çimma a-a Lanterna.	DEIZE, Council for Ligurian Linguistic Heritage, 2019-2023, https://conseggio-ligure.org/en/dictionary/deize/
Montemmo sciù in casa.	DEIZE, Council for Ligurian Linguistic Heritage, 2019-2023, https://conseggio-ligure.org/en/dictionary/deize/
Mòrto da-a famme.	DEIZE, Council for Ligurian Linguistic Heritage, 2019-2023, https://conseggio-ligure.org/en/dictionary/deize/
Mòrto strangoou.	DEIZE, Council for Ligurian Linguistic Heritage, 2019-2023, https://conseggio-ligure.org/en/dictionary/deize/
Mòtto de succao.	DEIZE, Council for Ligurian Linguistic Heritage, 2019-2023, https://conseggio-ligure.org/en/dictionary/deize/
Muâ un barcon.	DEIZE, Council for Ligurian Linguistic Heritage, 2019-2023, https://conseggio-ligure.org/en/dictionary/deize/
N’à fermou a poliscia pe-a stradda.	DEIZE, Council for Ligurian Linguistic Heritage, 2019-2023, https://conseggio-ligure.org/en/dictionary/deize/
N’aggi poia, o cine o no l’é ancon comensou.	DEIZE, Council for Ligurian Linguistic Heritage, 2019-2023, https://conseggio-ligure.org/en/dictionary/deize/
N’an inandiou un stuffou de pòrco sarvægo.	DEIZE, Council for Ligurian Linguistic Heritage, 2019-2023, https://conseggio-ligure.org/en/dictionary/deize/
N’an visto in ciæo e l’é comensou tutt’assemme à giâ de voxe in sce de niatri.	DEIZE, Council for Ligurian Linguistic Heritage, 2019-2023, https://conseggio-ligure.org/en/dictionary/deize/
Na.	DEIZE, Council for Ligurian Linguistic Heritage, 2019-2023, https://conseggio-ligure.org/en/dictionary/deize/
Natale a-o barcon e Pasqua a-o tisson.	DEIZE, Council for Ligurian Linguistic Heritage, 2019-2023, https://conseggio-ligure.org/en/dictionary/deize/
Navego pe tutti i mâ do mondo.	DEIZE, Council for Ligurian Linguistic Heritage, 2019-2023, https://conseggio-ligure.org/en/dictionary/deize/
Ne gusta i vin lombardi.	DEIZE, Council for Ligurian Linguistic Heritage, 2019-2023, https://conseggio-ligure.org/en/dictionary/deize/
Ne son seguo.	DEIZE, Council for Ligurian Linguistic Heritage, 2019-2023, https://conseggio-ligure.org/en/dictionary/deize/
Neive sciòcca.	DEIZE, Council for Ligurian Linguistic Heritage, 2019-2023, https://conseggio-ligure.org/en/dictionary/deize/
Neuve caròttoe.	DEIZE, Council for Ligurian Linguistic Heritage, 2019-2023, https://conseggio-ligure.org/en/dictionary/deize/
Ni vivo ni mòrto.	DEIZE, Council for Ligurian Linguistic Heritage, 2019-2023, https://conseggio-ligure.org/en/dictionary/deize/
Niatri emmo za fæto.	DEIZE, Council for Ligurian Linguistic Heritage, 2019-2023, https://conseggio-ligure.org/en/dictionary/deize/
Nisciun contegnuo stæto attrovou pe st’adresso.	DEIZE, Council for Ligurian Linguistic Heritage, 2019-2023, https://conseggio-ligure.org/en/dictionary/deize/
Nisciun l’é contento à sto mondo.	DEIZE, Council for Ligurian Linguistic Heritage, 2019-2023, https://conseggio-ligure.org/en/dictionary/deize/
Nisciun o l’accapisce e barsellette ch’o conta.	DEIZE, Council for Ligurian Linguistic Heritage, 2019-2023, https://conseggio-ligure.org/en/dictionary/deize/
Nisciun o sa che sei chì.	DEIZE, Council for Ligurian Linguistic Heritage, 2019-2023, https://conseggio-ligure.org/en/dictionary/deize/
Nisciun o se n’indubita.	DEIZE, Council for Ligurian Linguistic Heritage, 2019-2023, https://conseggio-ligure.org/en/dictionary/deize/
Nisciuña borrasca prevista.	DEIZE, Council for Ligurian Linguistic Heritage, 2019-2023, https://conseggio-ligure.org/en/dictionary/deize/
Nisseua sarvæga.	DEIZE, Council for Ligurian Linguistic Heritage, 2019-2023, https://conseggio-ligure.org/en/dictionary/deize/
Nisseue brustolie.	DEIZE, Council for Ligurian Linguistic Heritage, 2019-2023, https://conseggio-ligure.org/en/dictionary/deize/
No arriëscio à desentegâ i ratti into staggio.	DEIZE, Council for Ligurian Linguistic Heritage, 2019-2023, https://conseggio-ligure.org/en/dictionary/deize/
No arriëscio à tegnîme o rie.	DEIZE, Council for Ligurian Linguistic Heritage, 2019-2023, https://conseggio-ligure.org/en/dictionary/deize/
No avei de çervello in succa.	DEIZE, Council for Ligurian Linguistic Heritage, 2019-2023, https://conseggio-ligure.org/en/dictionary/deize/
No avei de reguardo.	DEIZE, Council for Ligurian Linguistic Heritage, 2019-2023, https://conseggio-ligure.org/en/dictionary/deize/
No avei gaibo à fâ unna cösa.	DEIZE, Council for Ligurian Linguistic Heritage, 2019-2023, https://conseggio-ligure.org/en/dictionary/deize/
No avei manco tempo da dâse do dio pe-a bocca.	DEIZE, Council for Ligurian Linguistic Heritage, 2019-2023, https://conseggio-ligure.org/en/dictionary/deize/
No avei ninte in conträio.	DEIZE, Council for Ligurian Linguistic Heritage, 2019-2023, https://conseggio-ligure.org/en/dictionary/deize/
No avei steumago à unna cösa.	DEIZE, Council for Ligurian Linguistic Heritage, 2019-2023, https://conseggio-ligure.org/en/dictionary/deize/
No avei un södo da cavâse un euggio.	DEIZE, Council for Ligurian Linguistic Heritage, 2019-2023, https://conseggio-ligure.org/en/dictionary/deize/
No bagnâ a bocca d’ægua.	DEIZE, Council for Ligurian Linguistic Heritage, 2019-2023, https://conseggio-ligure.org/en/dictionary/deize/
No beseugna ch’ô femmo ancheu, poemmo aspëtâ ancon dötrei giorni.	DEIZE, Council for Ligurian Linguistic Heritage, 2019-2023, https://conseggio-ligure.org/en/dictionary/deize/
No beseugna parlâ co-a bocca piña.	DEIZE, Council for Ligurian Linguistic Heritage, 2019-2023, https://conseggio-ligure.org/en/dictionary/deize/
No capiscio comme o poëse comportâ quelle paròlle.	DEIZE, Council for Ligurian Linguistic Heritage, 2019-2023, https://conseggio-ligure.org/en/dictionary/deize/
No capiscio percöse o s’é portou à quello mòddo.	DEIZE, Council for Ligurian Linguistic Heritage, 2019-2023, https://conseggio-ligure.org/en/dictionary/deize/
No capivan comme a poëse parlâ coscì a sò moæ.	DEIZE, Council for Ligurian Linguistic Heritage, 2019-2023, https://conseggio-ligure.org/en/dictionary/deize/
No conosce o pan da-e prie.	DEIZE, Council for Ligurian Linguistic Heritage, 2019-2023, https://conseggio-ligure.org/en/dictionary/deize/
No conoscio a biscambiggia.	DEIZE, Council for Ligurian Linguistic Heritage, 2019-2023, https://conseggio-ligure.org/en/dictionary/deize/
No dâ manco tanto tempo da pisciâ.	DEIZE, Council for Ligurian Linguistic Heritage, 2019-2023, https://conseggio-ligure.org/en/dictionary/deize/
No dovei sciortî d’in scagno pe nisciuña raxon, se semmo capii?	DEIZE, Council for Ligurian Linguistic Heritage, 2019-2023, https://conseggio-ligure.org/en/dictionary/deize/
No ê saveiva tutte ste cöse.	DEIZE, Council for Ligurian Linguistic Heritage, 2019-2023, https://conseggio-ligure.org/en/dictionary/deize/
No ê treuvo.	DEIZE, Council for Ligurian Linguistic Heritage, 2019-2023, https://conseggio-ligure.org/en/dictionary/deize/
No ê trovava da nisciuña parte.	DEIZE, Council for Ligurian Linguistic Heritage, 2019-2023, https://conseggio-ligure.org/en/dictionary/deize/
No emmo ninte in conträio.	DEIZE, Council for Ligurian Linguistic Heritage, 2019-2023, https://conseggio-ligure.org/en/dictionary/deize/
No emmo o numero legale.	DEIZE, Council for Ligurian Linguistic Heritage, 2019-2023, https://conseggio-ligure.org/en/dictionary/deize/
No ëse bon né pe seua, né pe tomæa.	DEIZE, Council for Ligurian Linguistic Heritage, 2019-2023, https://conseggio-ligure.org/en/dictionary/deize/
No ëse into calendäio de unna persoña.	DEIZE, Council for Ligurian Linguistic Heritage, 2019-2023, https://conseggio-ligure.org/en/dictionary/deize/
No ëse quello chi à inventou a povie.	DEIZE, Council for Ligurian Linguistic Heritage, 2019-2023, https://conseggio-ligure.org/en/dictionary/deize/
No ësighe dinæ da poei pagâ unna cösa.	DEIZE, Council for Ligurian Linguistic Heritage, 2019-2023, https://conseggio-ligure.org/en/dictionary/deize/
No fâghe caxo, ô fan solo pe demoâse.	DEIZE, Council for Ligurian Linguistic Heritage, 2019-2023, https://conseggio-ligure.org/en/dictionary/deize/
No gh’é barba d’òmmo chi pòsse.	DEIZE, Council for Ligurian Linguistic Heritage, 2019-2023, https://conseggio-ligure.org/en/dictionary/deize/
No gh’é ciù de stelle in çê.	DEIZE, Council for Ligurian Linguistic Heritage, 2019-2023, https://conseggio-ligure.org/en/dictionary/deize/
No gh’é da fâ sguassi.	DEIZE, Council for Ligurian Linguistic Heritage, 2019-2023, https://conseggio-ligure.org/en/dictionary/deize/
No gh’é de fainâ, ni de fugassa, ni de panissa.	DEIZE, Council for Ligurian Linguistic Heritage, 2019-2023, https://conseggio-ligure.org/en/dictionary/deize/
No gh’é de sprescia.	DEIZE, Council for Ligurian Linguistic Heritage, 2019-2023, https://conseggio-ligure.org/en/dictionary/deize/
No gh’é franco nisciun.	DEIZE, Council for Ligurian Linguistic Heritage, 2019-2023, https://conseggio-ligure.org/en/dictionary/deize/
No gh’é mai stæto vento sens’ægua.	DEIZE, Council for Ligurian Linguistic Heritage, 2019-2023, https://conseggio-ligure.org/en/dictionary/deize/
No gh’é nisciun ch’o l’agge visto.	DEIZE, Council for Ligurian Linguistic Heritage, 2019-2023, https://conseggio-ligure.org/en/dictionary/deize/
No gh’é nisciun?	DEIZE, Council for Ligurian Linguistic Heritage, 2019-2023, https://conseggio-ligure.org/en/dictionary/deize/
No gh’é nisciuña sprescia.	DEIZE, Council for Ligurian Linguistic Heritage, 2019-2023, https://conseggio-ligure.org/en/dictionary/deize/
No gh’é òmmo a-o mondo ch’ô pòsse dî.	DEIZE, Council for Ligurian Linguistic Heritage, 2019-2023, https://conseggio-ligure.org/en/dictionary/deize/
No gh’é pezo cösa.	DEIZE, Council for Ligurian Linguistic Heritage, 2019-2023, https://conseggio-ligure.org/en/dictionary/deize/
No gh’é reusa sensa spiñe.	DEIZE, Council for Ligurian Linguistic Heritage, 2019-2023, https://conseggio-ligure.org/en/dictionary/deize/
