Sentence	Source
Piggiâ a penscion.	DEIZE, Council for Ligurian Linguistic Heritage, 2019-2023, https://conseggio-ligure.org/en/dictionary/deize/
Piggiâ a spòrta e i færi.	DEIZE, Council for Ligurian Linguistic Heritage, 2019-2023, https://conseggio-ligure.org/en/dictionary/deize/
Piggiâ a-a preuva.	DEIZE, Council for Ligurian Linguistic Heritage, 2019-2023, https://conseggio-ligure.org/en/dictionary/deize/
Piggiâ a-o consummo unna persoña.	DEIZE, Council for Ligurian Linguistic Heritage, 2019-2023, https://conseggio-ligure.org/en/dictionary/deize/
Piggiâ de mesue de restriçion.	DEIZE, Council for Ligurian Linguistic Heritage, 2019-2023, https://conseggio-ligure.org/en/dictionary/deize/
Piggiâ e sò mesue ne-o fâ unna cösa.	DEIZE, Council for Ligurian Linguistic Heritage, 2019-2023, https://conseggio-ligure.org/en/dictionary/deize/
Piggiâ exempio da unna persoña.	DEIZE, Council for Ligurian Linguistic Heritage, 2019-2023, https://conseggio-ligure.org/en/dictionary/deize/
Piggiâ l’ammia in sciô bersaggio.	DEIZE, Council for Ligurian Linguistic Heritage, 2019-2023, https://conseggio-ligure.org/en/dictionary/deize/
Piggiâ l’asbrio.	DEIZE, Council for Ligurian Linguistic Heritage, 2019-2023, https://conseggio-ligure.org/en/dictionary/deize/
Piggiâ l’asmia.	DEIZE, Council for Ligurian Linguistic Heritage, 2019-2023, https://conseggio-ligure.org/en/dictionary/deize/
Piggiâ l’euggio do cû pe unna ciaga.	DEIZE, Council for Ligurian Linguistic Heritage, 2019-2023, https://conseggio-ligure.org/en/dictionary/deize/
Piggiâ lampo comme a povie.	DEIZE, Council for Ligurian Linguistic Heritage, 2019-2023, https://conseggio-ligure.org/en/dictionary/deize/
Piggiâ o cheuio à unna persoña.	DEIZE, Council for Ligurian Linguistic Heritage, 2019-2023, https://conseggio-ligure.org/en/dictionary/deize/
Piggiâ o desciù à unna persoña.	DEIZE, Council for Ligurian Linguistic Heritage, 2019-2023, https://conseggio-ligure.org/en/dictionary/deize/
Piggiâ o dexe de dinæ.	DEIZE, Council for Ligurian Linguistic Heritage, 2019-2023, https://conseggio-ligure.org/en/dictionary/deize/
Piggia o pægua perché anià à ceuve.	DEIZE, Council for Ligurian Linguistic Heritage, 2019-2023, https://conseggio-ligure.org/en/dictionary/deize/
Piggiâ o sugo da un libbro.	DEIZE, Council for Ligurian Linguistic Heritage, 2019-2023, https://conseggio-ligure.org/en/dictionary/deize/
Piggiâ o tempo comm’o ven.	DEIZE, Council for Ligurian Linguistic Heritage, 2019-2023, https://conseggio-ligure.org/en/dictionary/deize/
Piggiâ parte à unna manifestaçion.	DEIZE, Council for Ligurian Linguistic Heritage, 2019-2023, https://conseggio-ligure.org/en/dictionary/deize/
Piggiâ un figgeu, un cagnetto in adoçion.	DEIZE, Council for Ligurian Linguistic Heritage, 2019-2023, https://conseggio-ligure.org/en/dictionary/deize/
Piggiâ unn’impreisa.	DEIZE, Council for Ligurian Linguistic Heritage, 2019-2023, https://conseggio-ligure.org/en/dictionary/deize/
Piggiâse a peña de fâ unna cösa.	DEIZE, Council for Ligurian Linguistic Heritage, 2019-2023, https://conseggio-ligure.org/en/dictionary/deize/
Piggiâse de gatte ligæ.	DEIZE, Council for Ligurian Linguistic Heritage, 2019-2023, https://conseggio-ligure.org/en/dictionary/deize/
Piggiâse l’assonto de fâ.	DEIZE, Council for Ligurian Linguistic Heritage, 2019-2023, https://conseggio-ligure.org/en/dictionary/deize/
Piggiâse un ballon inta faccia.	DEIZE, Council for Ligurian Linguistic Heritage, 2019-2023, https://conseggio-ligure.org/en/dictionary/deize/
Piggiâse un resato.	DEIZE, Council for Ligurian Linguistic Heritage, 2019-2023, https://conseggio-ligure.org/en/dictionary/deize/
Piggiâsela con còmmodo.	DEIZE, Council for Ligurian Linguistic Heritage, 2019-2023, https://conseggio-ligure.org/en/dictionary/deize/
Piggiâsela in rie.	DEIZE, Council for Ligurian Linguistic Heritage, 2019-2023, https://conseggio-ligure.org/en/dictionary/deize/
Piggio l’autobo tutti i giorni pe anâ in sciô travaggio.	DEIZE, Council for Ligurian Linguistic Heritage, 2019-2023, https://conseggio-ligure.org/en/dictionary/deize/
Piggio o pægua de za che ceuve.	DEIZE, Council for Ligurian Linguistic Heritage, 2019-2023, https://conseggio-ligure.org/en/dictionary/deize/
Piggite ancon un pittin de doçe!	DEIZE, Council for Ligurian Linguistic Heritage, 2019-2023, https://conseggio-ligure.org/en/dictionary/deize/
Pigheuggio infainou.	DEIZE, Council for Ligurian Linguistic Heritage, 2019-2023, https://conseggio-ligure.org/en/dictionary/deize/
Piscia ciæo e incaghite do mego.	DEIZE, Council for Ligurian Linguistic Heritage, 2019-2023, https://conseggio-ligure.org/en/dictionary/deize/
Polenta co-i mòtti.	DEIZE, Council for Ligurian Linguistic Heritage, 2019-2023, https://conseggio-ligure.org/en/dictionary/deize/
Pòmmo de reusa.	DEIZE, Council for Ligurian Linguistic Heritage, 2019-2023, https://conseggio-ligure.org/en/dictionary/deize/
Ponente-meistro.	DEIZE, Council for Ligurian Linguistic Heritage, 2019-2023, https://conseggio-ligure.org/en/dictionary/deize/
Ponto incroxou.	DEIZE, Council for Ligurian Linguistic Heritage, 2019-2023, https://conseggio-ligure.org/en/dictionary/deize/
Porcaia de onge.	DEIZE, Council for Ligurian Linguistic Heritage, 2019-2023, https://conseggio-ligure.org/en/dictionary/deize/
Portâ a borsa in scê spalle.	DEIZE, Council for Ligurian Linguistic Heritage, 2019-2023, https://conseggio-ligure.org/en/dictionary/deize/
Portâ à scheuve e bestie.	DEIZE, Council for Ligurian Linguistic Heritage, 2019-2023, https://conseggio-ligure.org/en/dictionary/deize/
Portâ a-a roviña.	DEIZE, Council for Ligurian Linguistic Heritage, 2019-2023, https://conseggio-ligure.org/en/dictionary/deize/
Portâ de boñe neuve.	DEIZE, Council for Ligurian Linguistic Heritage, 2019-2023, https://conseggio-ligure.org/en/dictionary/deize/
Portâ in bocca comme i chen barbin.	DEIZE, Council for Ligurian Linguistic Heritage, 2019-2023, https://conseggio-ligure.org/en/dictionary/deize/
Portâ in carreghetta in d’öo.	DEIZE, Council for Ligurian Linguistic Heritage, 2019-2023, https://conseggio-ligure.org/en/dictionary/deize/
Portâ o desmuo.	DEIZE, Council for Ligurian Linguistic Heritage, 2019-2023, https://conseggio-ligure.org/en/dictionary/deize/
Portâ unna cadenetta a-o còllo.	DEIZE, Council for Ligurian Linguistic Heritage, 2019-2023, https://conseggio-ligure.org/en/dictionary/deize/
Pòrtilo con ti.	DEIZE, Council for Ligurian Linguistic Heritage, 2019-2023, https://conseggio-ligure.org/en/dictionary/deize/
Portime unna bottiggia de vin gianco.	DEIZE, Council for Ligurian Linguistic Heritage, 2019-2023, https://conseggio-ligure.org/en/dictionary/deize/
Portiò i vòstri ögui, i vòstri salui.	DEIZE, Council for Ligurian Linguistic Heritage, 2019-2023, https://conseggio-ligure.org/en/dictionary/deize/
Poulo o l’é o figgio ciù piccin.	DEIZE, Council for Ligurian Linguistic Heritage, 2019-2023, https://conseggio-ligure.org/en/dictionary/deize/
Pöveo figgeu!	DEIZE, Council for Ligurian Linguistic Heritage, 2019-2023, https://conseggio-ligure.org/en/dictionary/deize/
Præ Gazzo.	DEIZE, Council for Ligurian Linguistic Heritage, 2019-2023, https://conseggio-ligure.org/en/dictionary/deize/
Predican che o Segnô o l’à creou l’universo.	DEIZE, Council for Ligurian Linguistic Heritage, 2019-2023, https://conseggio-ligure.org/en/dictionary/deize/
Pregâ co-e brasse in croxe.	DEIZE, Council for Ligurian Linguistic Heritage, 2019-2023, https://conseggio-ligure.org/en/dictionary/deize/
Pregan e se battan o peto.	DEIZE, Council for Ligurian Linguistic Heritage, 2019-2023, https://conseggio-ligure.org/en/dictionary/deize/
Preisa de tabacco.	DEIZE, Council for Ligurian Linguistic Heritage, 2019-2023, https://conseggio-ligure.org/en/dictionary/deize/
Prescion erta in sciô Mediterraneo do mezo de ponente.	DEIZE, Council for Ligurian Linguistic Heritage, 2019-2023, https://conseggio-ligure.org/en/dictionary/deize/
Presentâ un programma de televixon.	DEIZE, Council for Ligurian Linguistic Heritage, 2019-2023, https://conseggio-ligure.org/en/dictionary/deize/
Previxon valida fin à mëzaneutte de doman e tendensa inte dozz’oe apreuvo.	DEIZE, Council for Ligurian Linguistic Heritage, 2019-2023, https://conseggio-ligure.org/en/dictionary/deize/
Pria travaggiâ da-o tempo, da l’ægua.	DEIZE, Council for Ligurian Linguistic Heritage, 2019-2023, https://conseggio-ligure.org/en/dictionary/deize/
Primma che comensemmo, beseugna che seggimo tutti d’accòrdio.	DEIZE, Council for Ligurian Linguistic Heritage, 2019-2023, https://conseggio-ligure.org/en/dictionary/deize/
Primma d’anâ inderê à casa beseugna che passe à cattâ ancon un pâ de cöse a-o supermercou.	DEIZE, Council for Ligurian Linguistic Heritage, 2019-2023, https://conseggio-ligure.org/en/dictionary/deize/
Primma de moî beseugna veddine de belle.	DEIZE, Council for Ligurian Linguistic Heritage, 2019-2023, https://conseggio-ligure.org/en/dictionary/deize/
Primma de stiâ i lençeu, beseugna destendili ben ben.	DEIZE, Council for Ligurian Linguistic Heritage, 2019-2023, https://conseggio-ligure.org/en/dictionary/deize/
Primma finiscio o lou, dòppo sciòrto de cà.	DEIZE, Council for Ligurian Linguistic Heritage, 2019-2023, https://conseggio-ligure.org/en/dictionary/deize/
Prinçipe ereditäio.	DEIZE, Council for Ligurian Linguistic Heritage, 2019-2023, https://conseggio-ligure.org/en/dictionary/deize/
Privâ quarchedun do sò travaggio.	DEIZE, Council for Ligurian Linguistic Heritage, 2019-2023, https://conseggio-ligure.org/en/dictionary/deize/
Prononçiâ ben e paròlle.	DEIZE, Council for Ligurian Linguistic Heritage, 2019-2023, https://conseggio-ligure.org/en/dictionary/deize/
Pronti?	DEIZE, Council for Ligurian Linguistic Heritage, 2019-2023, https://conseggio-ligure.org/en/dictionary/deize/
Pronto a-o sagrifiçio pe-i sò amixi.	DEIZE, Council for Ligurian Linguistic Heritage, 2019-2023, https://conseggio-ligure.org/en/dictionary/deize/
Pròpio à propòxito.	DEIZE, Council for Ligurian Linguistic Heritage, 2019-2023, https://conseggio-ligure.org/en/dictionary/deize/
Pròpio coscì, t’æ raxon!	DEIZE, Council for Ligurian Linguistic Heritage, 2019-2023, https://conseggio-ligure.org/en/dictionary/deize/
Pròpio dòppo Dënâ.	DEIZE, Council for Ligurian Linguistic Heritage, 2019-2023, https://conseggio-ligure.org/en/dictionary/deize/
Provæ à passâ de chì.	DEIZE, Council for Ligurian Linguistic Heritage, 2019-2023, https://conseggio-ligure.org/en/dictionary/deize/
Pubricâ inte unna revista.	DEIZE, Council for Ligurian Linguistic Heritage, 2019-2023, https://conseggio-ligure.org/en/dictionary/deize/
Pubricâ un libbro, un cine.	DEIZE, Council for Ligurian Linguistic Heritage, 2019-2023, https://conseggio-ligure.org/en/dictionary/deize/
Quæ a l’é a machina ch’a t’ê ciù caa?	DEIZE, Council for Ligurian Linguistic Heritage, 2019-2023, https://conseggio-ligure.org/en/dictionary/deize/
Quæ l’é o senso da vitta?	DEIZE, Council for Ligurian Linguistic Heritage, 2019-2023, https://conseggio-ligure.org/en/dictionary/deize/
Quæ o l’é ch’o t’é ciù cao?	DEIZE, Council for Ligurian Linguistic Heritage, 2019-2023, https://conseggio-ligure.org/en/dictionary/deize/
Quæ o l’é o ligure che se deuvia chì?	DEIZE, Council for Ligurian Linguistic Heritage, 2019-2023, https://conseggio-ligure.org/en/dictionary/deize/
Quæ o l’é o treno?	DEIZE, Council for Ligurian Linguistic Heritage, 2019-2023, https://conseggio-ligure.org/en/dictionary/deize/
Quæ o l’é o volumme da Tæra?	DEIZE, Council for Ligurian Linguistic Heritage, 2019-2023, https://conseggio-ligure.org/en/dictionary/deize/
Quand’o m’à visto passâ pe-a stradda, o m’à ciammou.	DEIZE, Council for Ligurian Linguistic Heritage, 2019-2023, https://conseggio-ligure.org/en/dictionary/deize/
Quand’o s’é dæto conto da festa à sorpreisa che gh’aivimo inandiou o s’é commòsso.	DEIZE, Council for Ligurian Linguistic Heritage, 2019-2023, https://conseggio-ligure.org/en/dictionary/deize/
Quande dòrmo sciato delongo o letto.	DEIZE, Council for Ligurian Linguistic Heritage, 2019-2023, https://conseggio-ligure.org/en/dictionary/deize/
Quande gh’é cado a giassa a se deslengua.	DEIZE, Council for Ligurian Linguistic Heritage, 2019-2023, https://conseggio-ligure.org/en/dictionary/deize/
Quande gh’é da fâ un servixo, o no dixe mai de no.	DEIZE, Council for Ligurian Linguistic Heritage, 2019-2023, https://conseggio-ligure.org/en/dictionary/deize/
Quande ghe l’ò dito, o no voeiva creddighe.	DEIZE, Council for Ligurian Linguistic Heritage, 2019-2023, https://conseggio-ligure.org/en/dictionary/deize/
Quande ghe sata a bostica, o comensa à tiâ zu di tacchi.	DEIZE, Council for Ligurian Linguistic Heritage, 2019-2023, https://conseggio-ligure.org/en/dictionary/deize/
Quande i cavelli fan gianchin, lascia e dònne e attacchite a-o vin.	DEIZE, Council for Ligurian Linguistic Heritage, 2019-2023, https://conseggio-ligure.org/en/dictionary/deize/
Quande l’é ch’o l’à comensou à insegnâ inte l’universcitæ?	DEIZE, Council for Ligurian Linguistic Heritage, 2019-2023, https://conseggio-ligure.org/en/dictionary/deize/
Quande l’é che ariemmo?	DEIZE, Council for Ligurian Linguistic Heritage, 2019-2023, https://conseggio-ligure.org/en/dictionary/deize/
Quande l’é che dan e pagelle?	DEIZE, Council for Ligurian Linguistic Heritage, 2019-2023, https://conseggio-ligure.org/en/dictionary/deize/
Quande no l’an trovâ in cà son sciortie.	DEIZE, Council for Ligurian Linguistic Heritage, 2019-2023, https://conseggio-ligure.org/en/dictionary/deize/
Quande o pöveo o fa limöxina a-o ricco o diao o se ne rie.	DEIZE, Council for Ligurian Linguistic Heritage, 2019-2023, https://conseggio-ligure.org/en/dictionary/deize/
Quande s’é fæto giorno eimo ancon apreuvo co-o viægio.	DEIZE, Council for Ligurian Linguistic Heritage, 2019-2023, https://conseggio-ligure.org/en/dictionary/deize/
Quande s’é in ballo beseugna ballâ.	DEIZE, Council for Ligurian Linguistic Heritage, 2019-2023, https://conseggio-ligure.org/en/dictionary/deize/
Quande sciortià o pròscimo libbro da saga?	DEIZE, Council for Ligurian Linguistic Heritage, 2019-2023, https://conseggio-ligure.org/en/dictionary/deize/
Quande ti arrivi?	DEIZE, Council for Ligurian Linguistic Heritage, 2019-2023, https://conseggio-ligure.org/en/dictionary/deize/
Quande ti l’æ a pròscima vixita?	DEIZE, Council for Ligurian Linguistic Heritage, 2019-2023, https://conseggio-ligure.org/en/dictionary/deize/
Quande ti vëgni à trovâme?	DEIZE, Council for Ligurian Linguistic Heritage, 2019-2023, https://conseggio-ligure.org/en/dictionary/deize/
Quande vegniei torna à Saña?	DEIZE, Council for Ligurian Linguistic Heritage, 2019-2023, https://conseggio-ligure.org/en/dictionary/deize/
Quando ceuve e luxe o sô, tutte e strie fan l’amô.	DEIZE, Council for Ligurian Linguistic Heritage, 2019-2023, https://conseggio-ligure.org/en/dictionary/deize/
Quando no ghe n’é, a gexa a ne perde.	DEIZE, Council for Ligurian Linguistic Heritage, 2019-2023, https://conseggio-ligure.org/en/dictionary/deize/
Quando o çê o l’é fæto à pan, se no ceuve ancheu ceuve doman.	DEIZE, Council for Ligurian Linguistic Heritage, 2019-2023, https://conseggio-ligure.org/en/dictionary/deize/
Quando o gatto o passaggia, i ratti stan ascosi.	DEIZE, Council for Ligurian Linguistic Heritage, 2019-2023, https://conseggio-ligure.org/en/dictionary/deize/
Quando se ven vegi s’é schivæ da tutti.	DEIZE, Council for Ligurian Linguistic Heritage, 2019-2023, https://conseggio-ligure.org/en/dictionary/deize/
Quando ti gh’andavi, mi ne vegniva.	DEIZE, Council for Ligurian Linguistic Heritage, 2019-2023, https://conseggio-ligure.org/en/dictionary/deize/
Quant’a ghe mette sta vittua pe arrivâ a-i çento chillòmetri à l’oa?	DEIZE, Council for Ligurian Linguistic Heritage, 2019-2023, https://conseggio-ligure.org/en/dictionary/deize/
Quant’a vëgne sta scurtua de bronzo?	DEIZE, Council for Ligurian Linguistic Heritage, 2019-2023, https://conseggio-ligure.org/en/dictionary/deize/
Quante ghe veu pe arrivâ fin à in çentro?	DEIZE, Council for Ligurian Linguistic Heritage, 2019-2023, https://conseggio-ligure.org/en/dictionary/deize/
Quante n’emmo ancheu?	DEIZE, Council for Ligurian Linguistic Heritage, 2019-2023, https://conseggio-ligure.org/en/dictionary/deize/
Quante o l’é grande sto campo chì?	DEIZE, Council for Ligurian Linguistic Heritage, 2019-2023, https://conseggio-ligure.org/en/dictionary/deize/
Quante o t’à ciammou pe-e caròttoe?	DEIZE, Council for Ligurian Linguistic Heritage, 2019-2023, https://conseggio-ligure.org/en/dictionary/deize/
Quante o vëgne quello libbro?	DEIZE, Council for Ligurian Linguistic Heritage, 2019-2023, https://conseggio-ligure.org/en/dictionary/deize/
Quante oe ti studdi a-o giorno?	DEIZE, Council for Ligurian Linguistic Heritage, 2019-2023, https://conseggio-ligure.org/en/dictionary/deize/
Quante t’æ camminou?	DEIZE, Council for Ligurian Linguistic Heritage, 2019-2023, https://conseggio-ligure.org/en/dictionary/deize/
Quante t’an ciammou pe dâ recatto a-e scarpe?	DEIZE, Council for Ligurian Linguistic Heritage, 2019-2023, https://conseggio-ligure.org/en/dictionary/deize/
Quante t’é bella!	DEIZE, Council for Ligurian Linguistic Heritage, 2019-2023, https://conseggio-ligure.org/en/dictionary/deize/
Quante ve tocca spende a-o meise apreuvo a-a pixon?	DEIZE, Council for Ligurian Linguistic Heritage, 2019-2023, https://conseggio-ligure.org/en/dictionary/deize/
Quante vëgnan ste meizañe?	DEIZE, Council for Ligurian Linguistic Heritage, 2019-2023, https://conseggio-ligure.org/en/dictionary/deize/
Quante vegniva i bròccoli?	DEIZE, Council for Ligurian Linguistic Heritage, 2019-2023, https://conseggio-ligure.org/en/dictionary/deize/
Quarant’e quattro lampadiñe.	DEIZE, Council for Ligurian Linguistic Heritage, 2019-2023, https://conseggio-ligure.org/en/dictionary/deize/
Quaranta giorni de seçia.	DEIZE, Council for Ligurian Linguistic Heritage, 2019-2023, https://conseggio-ligure.org/en/dictionary/deize/
Quarchedun o m’à dito che o Marco o l’é anæto in penscion.	DEIZE, Council for Ligurian Linguistic Heritage, 2019-2023, https://conseggio-ligure.org/en/dictionary/deize/
Quarcösa da mette sotta i denti.	DEIZE, Council for Ligurian Linguistic Heritage, 2019-2023, https://conseggio-ligure.org/en/dictionary/deize/
Quattòrze pôtroñe.	DEIZE, Council for Ligurian Linguistic Heritage, 2019-2023, https://conseggio-ligure.org/en/dictionary/deize/
Quattro çento dozze sordatti.	DEIZE, Council for Ligurian Linguistic Heritage, 2019-2023, https://conseggio-ligure.org/en/dictionary/deize/
Quattro mia eutto çento vint’eutto litri d’euio.	DEIZE, Council for Ligurian Linguistic Heritage, 2019-2023, https://conseggio-ligure.org/en/dictionary/deize/
Quattro scemmi.	DEIZE, Council for Ligurian Linguistic Heritage, 2019-2023, https://conseggio-ligure.org/en/dictionary/deize/
Quell’òmmo o l’é un santo.	DEIZE, Council for Ligurian Linguistic Heritage, 2019-2023, https://conseggio-ligure.org/en/dictionary/deize/
Quella a l’é unn’atra cösa.	DEIZE, Council for Ligurian Linguistic Heritage, 2019-2023, https://conseggio-ligure.org/en/dictionary/deize/
Quella lì a l’é mæ moggê.	DEIZE, Council for Ligurian Linguistic Heritage, 2019-2023, https://conseggio-ligure.org/en/dictionary/deize/
Quella sò äia da patriçio.	DEIZE, Council for Ligurian Linguistic Heritage, 2019-2023, https://conseggio-ligure.org/en/dictionary/deize/
Quelli gatti stan a-o sô tutto o giorno.	DEIZE, Council for Ligurian Linguistic Heritage, 2019-2023, https://conseggio-ligure.org/en/dictionary/deize/
Quelli son i figgeu (de) che te diva.	DEIZE, Council for Ligurian Linguistic Heritage, 2019-2023, https://conseggio-ligure.org/en/dictionary/deize/
Quello ch’ò into cheu l’ò in bocca.	DEIZE, Council for Ligurian Linguistic Heritage, 2019-2023, https://conseggio-ligure.org/en/dictionary/deize/
Quello ch’o l’à fæto o parla da pe lê.	DEIZE, Council for Ligurian Linguistic Heritage, 2019-2023, https://conseggio-ligure.org/en/dictionary/deize/
Quello chi no va in campaña va in battaggio.	DEIZE, Council for Ligurian Linguistic Heritage, 2019-2023, https://conseggio-ligure.org/en/dictionary/deize/
Quello figgeu o l’é un tresto.	DEIZE, Council for Ligurian Linguistic Heritage, 2019-2023, https://conseggio-ligure.org/en/dictionary/deize/
Quello figgeu o mäveggiava tutti.	DEIZE, Council for Ligurian Linguistic Heritage, 2019-2023, https://conseggio-ligure.org/en/dictionary/deize/
Quello lì o l’é o mæ.	DEIZE, Council for Ligurian Linguistic Heritage, 2019-2023, https://conseggio-ligure.org/en/dictionary/deize/
Quello lì oua o no gh’intra.	DEIZE, Council for Ligurian Linguistic Heritage, 2019-2023, https://conseggio-ligure.org/en/dictionary/deize/
Quello òmmo o ghe mette angoscia.	DEIZE, Council for Ligurian Linguistic Heritage, 2019-2023, https://conseggio-ligure.org/en/dictionary/deize/
Quello pöveo figgeu o l’é finio in prexon.	DEIZE, Council for Ligurian Linguistic Heritage, 2019-2023, https://conseggio-ligure.org/en/dictionary/deize/
Quello pöveo meschinetto o cianzeiva.	DEIZE, Council for Ligurian Linguistic Heritage, 2019-2023, https://conseggio-ligure.org/en/dictionary/deize/
Quello vin o l’é grammo.	DEIZE, Council for Ligurian Linguistic Heritage, 2019-2023, https://conseggio-ligure.org/en/dictionary/deize/
Questa a l’é grania!	DEIZE, Council for Ligurian Linguistic Heritage, 2019-2023, https://conseggio-ligure.org/en/dictionary/deize/
Questa a l’é gròssa!	DEIZE, Council for Ligurian Linguistic Heritage, 2019-2023, https://conseggio-ligure.org/en/dictionary/deize/
Questa menestra a l’é un pö savoia.	DEIZE, Council for Ligurian Linguistic Heritage, 2019-2023, https://conseggio-ligure.org/en/dictionary/deize/
Questo figgio de unna scignoa.	DEIZE, Council for Ligurian Linguistic Heritage, 2019-2023, https://conseggio-ligure.org/en/dictionary/deize/
Rattellâse co-o prinçipâ.	DEIZE, Council for Ligurian Linguistic Heritage, 2019-2023, https://conseggio-ligure.org/en/dictionary/deize/
Raxonâ pe categorie.	DEIZE, Council for Ligurian Linguistic Heritage, 2019-2023, https://conseggio-ligure.org/en/dictionary/deize/
Reçitâ inte unna comedia.	DEIZE, Council for Ligurian Linguistic Heritage, 2019-2023, https://conseggio-ligure.org/en/dictionary/deize/
Redoggiâ e maneghe.	DEIZE, Council for Ligurian Linguistic Heritage, 2019-2023, https://conseggio-ligure.org/en/dictionary/deize/
Redoggiâse e maneghe da camixa.	DEIZE, Council for Ligurian Linguistic Heritage, 2019-2023, https://conseggio-ligure.org/en/dictionary/deize/
Regâ o terren, dâ da beive o terren.	DEIZE, Council for Ligurian Linguistic Heritage, 2019-2023, https://conseggio-ligure.org/en/dictionary/deize/
Regiña de coppe.	DEIZE, Council for Ligurian Linguistic Heritage, 2019-2023, https://conseggio-ligure.org/en/dictionary/deize/
Remettise inte moen de unna persoña.	DEIZE, Council for Ligurian Linguistic Heritage, 2019-2023, https://conseggio-ligure.org/en/dictionary/deize/
Rendise mävosciuo.	DEIZE, Council for Ligurian Linguistic Heritage, 2019-2023, https://conseggio-ligure.org/en/dictionary/deize/
Respio l’äia boña de montagna.	DEIZE, Council for Ligurian Linguistic Heritage, 2019-2023, https://conseggio-ligure.org/en/dictionary/deize/
Responde a-e paròlle co-i fæti.	DEIZE, Council for Ligurian Linguistic Heritage, 2019-2023, https://conseggio-ligure.org/en/dictionary/deize/
Responde a-o telefono.	DEIZE, Council for Ligurian Linguistic Heritage, 2019-2023, https://conseggio-ligure.org/en/dictionary/deize/
Restâ con unna magnâ de mosche.	DEIZE, Council for Ligurian Linguistic Heritage, 2019-2023, https://conseggio-ligure.org/en/dictionary/deize/
Restâ con unna magnâ de vento.	DEIZE, Council for Ligurian Linguistic Heritage, 2019-2023, https://conseggio-ligure.org/en/dictionary/deize/
Riçeive unna smentia.	DEIZE, Council for Ligurian Linguistic Heritage, 2019-2023, https://conseggio-ligure.org/en/dictionary/deize/
Ridue unna persoña in sce l’astrego.	DEIZE, Council for Ligurian Linguistic Heritage, 2019-2023, https://conseggio-ligure.org/en/dictionary/deize/
Risponde con superbia.	DEIZE, Council for Ligurian Linguistic Heritage, 2019-2023, https://conseggio-ligure.org/en/dictionary/deize/
Röba chi manda un cattivo ödô.	DEIZE, Council for Ligurian Linguistic Heritage, 2019-2023, https://conseggio-ligure.org/en/dictionary/deize/
Röba da fâ rie i bibin.	DEIZE, Council for Ligurian Linguistic Heritage, 2019-2023, https://conseggio-ligure.org/en/dictionary/deize/
Röba da fâ vegnî i cavelli driti.	DEIZE, Council for Ligurian Linguistic Heritage, 2019-2023, https://conseggio-ligure.org/en/dictionary/deize/
Röba da figgeu.	DEIZE, Council for Ligurian Linguistic Heritage, 2019-2023, https://conseggio-ligure.org/en/dictionary/deize/
Röba finiscima accattâ a-o mercou.	DEIZE, Council for Ligurian Linguistic Heritage, 2019-2023, https://conseggio-ligure.org/en/dictionary/deize/
Roggiâ i denti.	DEIZE, Council for Ligurian Linguistic Heritage, 2019-2023, https://conseggio-ligure.org/en/dictionary/deize/
Rompî a testa à unna persoña.	DEIZE, Council for Ligurian Linguistic Heritage, 2019-2023, https://conseggio-ligure.org/en/dictionary/deize/
Rompî o zazzun.	DEIZE, Council for Ligurian Linguistic Heritage, 2019-2023, https://conseggio-ligure.org/en/dictionary/deize/
Rondaniña teito à teito pòrta l’euio à San Beneito.	DEIZE, Council for Ligurian Linguistic Heritage, 2019-2023, https://conseggio-ligure.org/en/dictionary/deize/
Roviñe romañe.	DEIZE, Council for Ligurian Linguistic Heritage, 2019-2023, https://conseggio-ligure.org/en/dictionary/deize/
