neuf allée du Mont Cindre, soixante-neuf mille trois cents Caluire-et-Cuire
deux chemin du Bois de Longe, soixante-neuf, cinq cent soixante-dix, Dardilly
vingt-sept rue Élie Rochette, soixante-neuf, zéro zéro sept à Lyon
Passage Tolozan, soixante-neuf mille un Lyon
Rue de Fontanières, soixante-neuf, cent Villeurbanne
Rue de la Haute-Valois, Millery
Allée Thalie à Saint-Genis-Laval
treize chemin de l'Araire
Cours Tolstoï au numéro vingt-six
sept allée Joséphine Bardon, soixante-neuf mille trois cent dix Pierre-Bénite
mille quatre cent soixante-dix-neuf route de Theizé, soixante-neuf, quatre cents, Pouilly-le-Monial
cent vingt-huit avenue Lacassagne, soixante-neuf, zéro zéro trois à Lyon
Route de Anse, soixante-neuf mille quatre cent quatre-vingts Lucenay
Avenue de Montmartin, soixante-neuf, neuf cent soixante Corbas
Allée B des Santons, Sainte-Foy-lès-Lyon
Square Huguette Bois à Saint-Priest
vingt rue Tronchet
Passage Lamure au numéro onze
trente-six rue des Confins du Château, soixante-neuf mille sept cents Chassagny
douze rue Antoine Ferraud, soixante-neuf, deux cent vingt, Belleville
dix-neuf chemin de la Ferlatière, soixante-neuf, trois cent soixante-dix à Saint-Didier-au-Mont-d'Or
Rue des Deux Amants, soixante-neuf mille neuf Lyon
Rue Paul Huvelin, soixante-neuf, cent dix Sainte-Foy-lès-Lyon
Allée Françoise Buffeton, Dardilly
Rue du Château de la Duchère à Lyon
un place Camille Georges
Rue Loyson de Chastelus au numéro cinq cent trente et un
quatre rue Victor Subit, soixante-neuf mille cent Villeurbanne
soixante-quinze impasse du Suel, soixante-neuf, sept cents, Échalas
vingt-quatre rue Jacques Reynaud, soixante-neuf, huit cents à Saint-Priest
Allée de la Piscine, soixante-neuf mille cinq cent trente Brignais
Rue Cité de l'Abbé Pierre, soixante-neuf, huit cents Saint-Priest
Boulevard Castellane, Sathonay-Camp
Chemin de Revaison à Saint-Priest
un rue Maxime Lalouette
Rue Capitaine Julien au numéro mille un
neuf avenue Jean Moos, soixante-neuf mille cinq cent cinquante Amplepuis
quatre impasse du Docteur Pénard, soixante-neuf, six cent trente, Chaponost
trente-cinq rue Albert Falsan, soixante-neuf, zéro zéro neuf à Lyon
Chemin de Crépieux, soixante-neuf mille trois cents Caluire-et-Cuire
Rue des Frères Caudron, soixante-neuf, trois cent trente Meyzieu
Rue du Clos des Coquilles, Francheville
Rue Ferdinand Perrier à Saint-Priest
quatre mille cent vingt-sept route du Grisard
Rue Marcel Merieux au numéro soixante-douze D
cent soixante-douze montée des Tiers, soixante-neuf mille quatre cents Liergues
trente-six rue Marie Mas, soixante-neuf, sept cents, Givors
dix-sept rue René Chapard, soixante-neuf, six cent trente à Chaponost
Rue Édouard Rochet, soixante-neuf mille huit Lyon
Quai Docteur Gailleton, soixante-neuf, zéro zéro deux Lyon
Allée du Val de Serres, Dardilly
Rue Benoit Badoil à Chaponost
vingt et un rue Antoine Vacher
Route des Monts d'Or au numéro deux cent huit
six cent quatre-vingt-deux H route du Bas Privas, soixante-neuf mille trois cent quatre-vingt-dix Charly
cent quarante et un rue Joannès Sabot, soixante-neuf, quatre cents, Villefranche-sur-Saône
cent vingt-cinq rue d'Anse, soixante-neuf, quatre cents à Villefranche-sur-Saône
Route de la Vauxonne, soixante-neuf mille quatre cent soixante Saint-Étienne-des-Oullières
Rue des Rivetières, soixante-neuf, deux cent vingt Dracé
Rue Hippolyte Côte, Tarare
Rue Fulgencio Gimenez à Vaulx-en-Velin
cent cinquante-trois chemin d'Apinost
Route de Toussieu au numéro quatorze
cinq chemin de Tholomé, soixante-neuf mille neuf cent soixante-dix Chaponnay
cinq avenue de Réaumur, soixante-neuf, cent cinquante, Décines-Charpieu
vingt-quatre quai de Charézieux, soixante-neuf, deux cent soixante-dix à Saint-Romain-au-Mont-d'Or
Chemin du Vallombrey, soixante-neuf mille cent trente Écully
Rue Pierre Brunier, soixante-neuf, trois cents Caluire-et-Cuire
Rue Bonnefond, Givors
Allée du Baraillon à Tassin-la-Demi-Lune
