quarante-neuf rue des Ayrelles, cinquante-trois mille Laval
dix-huit rue du Cardinal L.M Bille, cinquante-trois, zéro zéro zéro, Laval
cent dix rue d'Hilard, cinquante-trois, zéro zéro zéro à Laval
Place Terrepintonne, cinquante-trois mille cent cinquante Montsûrs
Rue des Abbés Gaugain, cinquante-trois, cent soixante Hambers
Rue des Quatres Vents, Château-Gontier
Rue de la Mauhitière à Mayenne
douze rue de l'Etamoire
Rue de l'Abbé Angot au numéro vingt-huit
cinq place Jacques de Montesson, cinquante-trois mille sept cents Saint-Aubin-du-Désert
dix BIS rue de Frénouse, cinquante-trois, deux cent trente, Cossé-le-Vivien
dix rue de la Vaige, cinquante-trois, cent soixante-dix à La Cropte
Rue des Trois Régiments, cinquante-trois mille Laval
Ruelle de Beausoleil, cinquante-trois, zéro zéro zéro Laval
Parc de la Sourderie, Villaines-la-Juhel
Route de Neau à Évron
six rue Henri Dès
Rue du Vieux Saint-Louis au numéro trois cent cinquante-cinq
un rue des Abélias, cinquante-trois mille quatre cent quarante La Bazoge-Montpinçon
vingt-sept rue de Bouletière, cinquante-trois, deux cent soixante, Entrammes
trente-trois route de Mirwault, cinquante-trois, deux cents à Château-Gontier
Rue du Bois de l'Huisserie, cinquante-trois mille Laval
Rue de la Chartrie, cinquante-trois, huit cent dix Changé
Allée Constant Feinte, Laval
Rue de Gesnes à Montsûrs
cinquante-deux boulevard Félix Grat
Rue de Louverné au numéro vingt-cinq
quatorze allée Pierre César Ferret, cinquante-trois mille Laval
neuf impasse Roger Bambuck, cinquante-trois, neuf cent cinquante, Louverné
vingt-neuf rue Ulphace Benoit, cinquante-trois, deux cent quarante à Andouillé
Impasse des Gonettes, cinquante-trois mille deux cent quarante Andouillé
Rue Pierre Barauderie, cinquante-trois, trois cent cinquante Fontaine-Couverte
Place Saint-Tugal, Laval
Rue Ambroise de Loré à Oisseau
sept rue de la Noue Fleurie
Rue du Heaume au numéro vingt-trois
quinze rue Livet de Monfeu, cinquante-trois mille six cents Évron
un rue Belle-Plante, cinquante-trois, cinq cents, Ernée
sept rue du Béron, cinquante-trois, deux cents à Coudray
Route de Château Gontier, cinquante-trois mille quatre cents Craon
Lotissement du Petit Marcilly, cinquante-trois, cent quatre-vingt-dix Landivy
Place d'Anjou, Laval
Lotissement de la Touche à La Chapelle-Craonnaise
vingt-six rue André de Lohéac
Rue Angèle Ligère au numéro dix
un rue Jean-Baptiste Robin, cinquante-trois mille neuf cent quarante Ahuillé
seize faubourg Sainte-Anne, cinquante-trois, trois cent cinquante, La Roë
onze rue du Domaine des Mottes, cinquante-trois, deux cent soixante à Forcé
Rue des Bordagers, cinquante-trois mille huit cent dix Changé
Route de Loigné, cinquante-trois, deux cents Château-Gontier
Rue de Bootz, Laval
Rue de Côuterne à Lassay-les-Châteaux
huit passage de Quincampoix
Rue de la Maillarderie au numéro soixante-sept
sept B rue du Château Trompette, cinquante-trois mille cent Mayenne
deux place Renault Morlière, cinquante-trois, cinq cents, Ernée
quatorze rue de l'Embûche, cinquante-trois, quatre cent quarante à Aron
Rue de Prés, cinquante-trois mille sept cents Courcité
Allée Prosper Mortou, cinquante-trois, zéro zéro zéro Laval
Rue de la Philipotière, Laval
Cité des Noyers à Javron-les-Chapelles
huit rue du Haut de l'Allée
Rue du Pont Gate au numéro quatorze
quatre avenue Raoul Vadepied, cinquante-trois mille six cents Châtres-la-Forêt
six rue Berthe Marcou, cinquante-trois, deux cent trente, Cossé-le-Vivien
seize rue de la Claverie, cinquante-trois, deux cents à Azé
Rue de la Chambrouillère, cinquante-trois mille neuf cent soixante Bonchamp-lès-Laval
Boulevard Brune, cinquante-trois, zéro zéro zéro Laval
Place Voisin, Ernée
Rue de Quifeu à Saint-Germain-le-Fouilloux
