quarante-sept rue du cent quarante-neuf e R.un., quatre-vingt-huit mille Épinal
vingt-sept chemin du Bas de la Rayée, quatre-vingt-huit, quatre cents, Gérardmer
quatre chemin du Pré du Lait, quatre-vingt-huit, cent vingt à Sapois
Rue du Haut de l'Âtre, quatre-vingt-huit mille cinq cents Rouvres-en-Xaintois
Rue de l'Avière, quatre-vingt-huit, trois cent quatre-vingt-dix Domèvre-sur-Avière
Rue de Maximont, Golbey
Chemin des Bas Rupts à Gérardmer
vingt-quatre chemin de l'Allegrerie
Chemin du Tandenet au numéro quinze
dix chemin de la Claye, quatre-vingt-huit mille six cents Girecourt-sur-Durbion
mille cent quatre-vingts rue du Val de Meurthe, quatre-vingt-huit, six cent cinquante, Anould
quarante-sept chemin de l'École des Xettes, quatre-vingt-huit, quatre cents à Gérardmer
Rue de Mamoine, quatre-vingt-huit mille quatre cent vingt Moyenmoutier
Rue du Lieutenant Seidel, quatre-vingt-huit, cent cinquante Thaon-les-Vosges
Rue Marcel Goulette, Charmes
Route de Senones à Denipaire
quatre chemin du Couchetat
Rue Charles Levy au numéro trente-huit
huit rue du Commandant Saint-Sernin, quatre-vingt-huit mille deux cent vingt Xertigny
quatre martimpré, quatre-vingt-huit, quatre cent trente, Gerbépal
huit place Oberkampf, quatre-vingt-huit, cent cinquante à Thaon-les-Vosges
Le Harcholet, quatre-vingt-huit mille deux cent dix Le Saulcy
Rue Max D'Ollone, quatre-vingt-huit, cent Saint-Dié-des-Vosges
Faubourg d'Ambrail, Épinal
Chemin de Labémont à Aumontzey
trois chemin Jules Méline
Rue Robert Marcillat au numéro quinze
cinq BIS route d'Essey-la-Côte, quatre-vingt-huit mille trois cent trente Damas-aux-Bois
six cent cinquante-trois rue des Savrons, quatre-vingt-huit, trois cent quatre-vingts, Archettes
vingt-six impasse des Chalets du Lac, quatre-vingt-huit, quatre cents à Xonrupt-Longemer
Rue de la Bolle, quatre-vingt-huit mille cent Saint-Dié-des-Vosges
Rue de la Xavée, quatre-vingt-huit, deux cents Remiremont
Rue de Lorima, Vittel
Rue de Genazeville à Granges-sur-Vologne
deux cent quatre-vingt-treize rue de Rabiémont
Derrière La Chapelle au numéro un
quatre cent un rue de Brehimont, quatre-vingt-huit mille quatre cent soixante-dix Saint-Michel-sur-Meurthe
vingt route de Saint-Dié, quatre-vingt-huit, six cents, Fontenay
cent vingt rue des Chartons, quatre-vingt-huit, cinq cent cinquante à Pouxeux
Rue de Blanchefeigne, quatre-vingt-huit mille six cent quarante Granges-sur-Vologne
Rue des Fusillés du dix-huit Novembre mille neuf cent quarante-quatre, quatre-vingt-huit, cent Saint-Dié-des-Vosges
Allée de la Bautremois, Crainvilliers
Rue d'Urbainroche à Rochesson
cinq cent six route de Rambervillers
Route de Hardemont au numéro deux
dix-huit rue de Foucharupt, quatre-vingt-huit mille cent Saint-Dié-des-Vosges
soixante et un rue de Saint-Ferjeux, quatre-vingt-huit, huit cents, Haréville
dix-huit D chemin de la Droite des Rupts, quatre-vingt-huit, quatre cents à Gérardmer
Route de Renauvoid, quatre-vingt-huit mille trois cent quatre-vingt-dix Sanchey
Route du Chapis, quatre-vingt-huit, quatre cent quatre-vingt-dix Combrimont
Rue de la Meix Aubry, Bazien
Chemin du Chaud Côté à Saint-Étienne-lès-Remiremont
six cent trente-neuf rue du Saut du Broc
Route de Madonne au numéro cent vingt
deux cent soixante-six rue de Rougibois, quatre-vingt-huit mille huit cents Vittel
quatre-vingt-dix-huit route de la Médelle, quatre-vingt-huit, deux cent quatre-vingt-dix, Saulxures-sur-Moselotte
cinq rue du Prèchamp, quatre-vingt-huit, cent cinquante à Oncourt
Rue de la Peute Pierre, quatre-vingt-huit mille six cents Bruyères
Rue Joseph Thiéry, quatre-vingt-huit, deux cent trente Ban-sur-Meurthe-Clefcy
Passage du Gai Soleil, Épinal
Rue Calouche à Vittel
six mille trois cent quatre-vingt-seize route Départementale quarante-deux Fleurchamp
Rue d'Olima au numéro quarante
dix chemin du Liernat, quatre-vingt-huit mille deux cent cinquante La Bresse
cent vingt-huit la Moiselle, quatre-vingt-huit, huit cents, Mandres-sur-Vair
soixante-dix-sept sous Le Bois, quatre-vingt-huit, zéro zéro zéro à Dogneville
Rue Juliette Ménéteau, quatre-vingt-huit mille cent quarante Bulgnéville
Route du Séchenat, quatre-vingt-huit, cinq cent quarante Bussang
Rue des Meix Beillia, Fresse-sur-Moselle
Place Alexis Ignace à Épinal
