deux cent quarante-neuf rue Fernand Desjardins, soixante mille sept cent trente Novillers
cent quatre-vingt-un rue de Tillarue, soixante, trois cent vingt, Saint-Sauveur
quatre rue Yvonne Drouin, soixante, neuf cent quarante à Cinqueux
Rue Reant Henri, soixante mille cent trente Wavignies
Rue de Savignies, soixante, zéro zéro zéro Beauvais
Sentier du Moulin d'Inval, Courcelles-lès-Gisors
Rue des Tournettes à Montiers
cent cinquante-cinq rue Belle Assise
Rue du Marais Colin au numéro douze
six rue de Froide Cuisse, soixante mille deux cent quarante Bachivillers
onze route de Dammartin, soixante, trois cent trente, Ève
cent douze grande Avenue, soixante, deux cent soixante à Lamorlaye
Rue Nationale Rn trente-deux, soixante mille cent soixante-dix Cambronne-lès-Ribécourt
Allée Jacques Topin, soixante, cent douze Milly-sur-Thérain
Rue de Bernes, Morangles
Avenue des Martyrs de la Liberté à Compiègne
cinquante-cinq rue de Marqueglise
Clos des Lauriers au numéro six
un rue du Champ du Mouton, soixante mille deux cent quatre-vingt-dix Monchy-Saint-Éloi
trente-neuf BIS rue Louis Hennon, soixante, quatre cent vingt, Tricot
trois rue de Montreuil sur Thérain, soixante, neuf cent trente à Bailleul-sur-Thérain
Rue Georges Méliés, soixante mille deux cent trente Chambly
Rue de Prés Miny, soixante, sept cents Pontpoint
Rue Charles Lescot, Pont-Sainte-Maxence
Rue Louis Nicolas Vauquelin à Noyon
sept rue Duvoir
Rue Jean Levert au numéro trente-cinq
vingt-sept rue de Carroix, soixante mille deux cent vingt Romescamps
quatorze voie Communale Ferme de la Chapelle, soixante, trois cents, Fontaine-Chaalis
seize rue de la Voierie, soixante, cent vingt à Hardivillers
Rue du Wart, soixante mille cinq cent dix Bresles
Rue Cambry, soixante, zéro zéro zéro Beauvais
Rue du Prince Radziwill, Ermenonville
Rue Amédée Bouquerel à Compiègne
un rue du Puits Berthaud
Chemin du Bois de Soavre au numéro quatre
trente BIS rue Lucien Hubaut, soixante mille cent quarante et un Boursonne
un rue Princesse Louise, soixante, neuf cent cinquante, Ermenonville
six rue du Vivier Corax, soixante, deux cents à Compiègne
Rue Corbier Thiébaut, soixante mille deux cent soixante-dix Gouvieux
Rue Montalet, soixante, cent dix Amblainville
Rue du Chanoine Seret, Cauvigny
Sente du Coq à Crépy-en-Valois
trois square Gabriel-Auguste Ancelet
Route de Mouy au numéro quatre
onze rue Amédée Levasseur, soixante mille deux cent vingt Boutavent
trente-neuf huit e Avenue, soixante, deux cent soixante, Lamorlaye
deux rue Victor Presson, soixante, deux cent trente à Chambly
Rue Brachedal, soixante mille deux cent quarante Chaumont-en-Vexin
Rue de Montdidier, soixante, cent trente Erquinvillers
Rue Alfred Goriot, Chambly
Rue du Docteur Gey à Andeville
douze rue des Blassiers
Rue Despinas au numéro vingt-deux
six BIS avenue Georges Bataille, soixante mille trois cent trente Le Plessis-Belleville
cent seize rue Marcel Balasse, soixante, deux cent quatre-vingts, Margny-lès-Compiègne
trente-neuf rue du Général Taupin, soixante, huit cent dix à Barbery
Square de la Mare-Gaudry, soixante mille deux cents Compiègne
Rue l'Écureuil, soixante, quatre cents Noyon
Rue Charles Deneux, Bresles
Rue du Champ des Cosaques à Noyon
sept allée Georges Feydeau
Square du Président Kennedy au numéro quatre
sept rue Suleau, soixante mille deux cent dix Sommereux
six rue du Clos du Jeu d'Arc, soixante, huit cent quatre-vingts, Le Meux
dix rue du Bois du Fayel, soixante, deux cent quarante à Bachivillers
Rue d'Arona, soixante mille deux cents Compiègne
Rue du Bois Saint-Martin, soixante, quatre cent quatre-vingts Abbeville-Saint-Lucien
Allée de la Prele, Noyon
Rue Alexandre Merelle à Lormaison
