quarante et un rue Colonel Grandier-Vazeille, trente-trois mille Bordeaux
seize rue du Docteur Fauché, trente-trois, six cent soixante-dix, Créon
quatre-vingt-dix avenue du Cap Ferret, trente-trois, cent vingt-sept à Saint-Jean-d'Illac
Allée de Chappaz, trente-trois mille quatre cent soixante Arsac
Lotissement Bouleaux de la Possession, trente-trois, trois cent quatre-vingts Marcheprime
Rue Francis Planté, Pessac
Rue Berruer à Bordeaux
quarante-quatre rue Auguste Brutails
Rue Chantecrit au numéro soixante-dix-huit
seize avenue du Chemin de la Vie, trente-trois mille quatre cent quarante Ambarès-et-Lagrave
dix rue de la Réousse, trente-trois, sept cent quarante, Arès
sept rue de l'Amiral Besson, trente-trois, sept cent dix à Bourg
Chemin Barreyres, trente-trois mille trois cent quatre-vingts Biganos
Rue de l'Amiral Pierre Mouly, trente-trois, cent vingt Arcachon
Rue Saint-Jean d'Etampes, Ayguemorte-les-Graves
Allée du Petit Mestey à Gujan-Mestras
vingt-trois quai Port de la Hume
Route d'Arcachon au numéro quarante-quatre
quinze rue de Ruat, trente-trois mille Bordeaux
quarante cours de l'Yser, trente-trois, zéro zéro zéro, Bordeaux
trente-trois rue Pierre Massieux, trente-trois, quatre cents à Talence
Route de Gouas, trente-trois mille trois cent quatre-vingt-dix Cartelègue
Rue Dubarry, trente-trois, cinq cent trente Bassens
Chemin de Guérin, Salles
Rue Bahus à Talence
vingt-trois rue Paul Commarieu
Allée de Grabasse au numéro douze
trente-cinq rue de la Dune Pontac, trente-trois mille cent vingt Arcachon
cent trente-six rue de Graney, trente-trois, quatre cent cinquante, Izon
quarante-huit cours Georges Mandel, trente-trois, cinq cent quatre-vingt-dix à Saint-Vivien-de-Médoc
Allée des Bruyères Cazaux, trente-trois mille cent quinze La Teste-de-Buch
Cours Xavier Moreau, trente-trois, sept cent vingt Podensac
Chemin du Biala, Cestas
Rue Chante Cigale à Gujan-Mestras
douze lotissement Les Moulins
Rue Medecin Jean Vialar Goudou au numéro quatre-vingt-six
cinq allée d'Anjou, trente-trois mille cinq cent dix Andernos-les-Bains
neuf rue Dubrana, trente-trois, trois cent vingt, Eysines
soixante et un rue Armand Sully Prudhomme, trente-trois, neuf cent quatre-vingts à Audenge
Rue de Piget, trente-trois mille deux cent quatre-vingt-dix Ludon-Médoc
Rue Fontaine du Bayle, trente-trois, cinq cent cinquante Le Tourne
Allée de Moulerens, Gradignan
Avenue des Galipes à La Teste-de-Buch
un avenue de la Croix d'Hors
Allée du Rivage au numéro douze
huit cité de Caulet, trente-trois mille Bordeaux
vingt-deux route de Roaillan, trente-trois, deux cent dix, Langon
vingt-huit rue Formigé, trente-trois, cent dix au Bouscat
Route de Langoiran, trente-trois mille cinq cent cinquante Capian
Impasse du Moulin de Pelissey, trente-trois, cent soixante-dix Gradignan
Avenue de Maubuisson, Carcans
Rue André Pujol à Pessac
douze rue Lageyre
Rue de Malbos au numéro trente-trois
vingt-cinq rue Félix-le-Carvennec, trente-trois mille sept cent quatre-vingts Soulac-sur-Mer
six rue Lagueyte, trente-trois, six cent quatre-vingts, Lacanau
onze rue Charles Nungesser, trente-trois, cent quinze à La Teste-de-Buch
Impasse du Cuvier, trente-trois mille trois cent vingt Le Taillan-Médoc
Route de Grimard, trente-trois, six cent soixante-dix Créon
Rue Desplats, Talence
Chemin Darnauran à Castelnau-de-Médoc
six allée Antonio Canova
Allée Tournesol au numéro quatre
cinq rue Jean Soula, trente-trois mille Bordeaux
onze rue Jean Pares, trente-trois, cent vingt-trois, Le Verdon-sur-Mer
cent soixante et un lotissement Village des Pins, trente-trois, quatre cent soixante-dix à Gujan-Mestras
Route du Port de Goulée, trente-trois mille trois cent quarante Valeyrac
Chemin de Courtade, trente-trois, cent quatre-vingt-cinq Le Haillan
Chemin de Vignac, Carignan-de-Bordeaux
Rue Daniel Danet à Eysines
