sept rue de Champagnac, quatre-vingt-sept mille six cents Rochechouart
sept route de Masmonède, quatre-vingt-sept, cinq cents, Ladignac-le-Long
trois impasse du Mas du Puy, quatre-vingt-sept, quatre cent trente à Verneuil-sur-Vienne
Rue du Puy Las Rodas, quatre-vingt-sept mille Limoges
Rue de Romanet, quatre-vingt-sept, zéro zéro zéro Limoges
Avenue des Ruchoux, Limoges
Rue de la Trahison à La Jonchère-Saint-Maurice
vingt et un rue Porte Panet
Route de Veyrinas au numéro dix
quatorze chemin des Congeries, quatre-vingt-sept mille deux cent trente Dournazac
quinze alléE Villagory, quatre-vingt-sept, zéro zéro zéro, Limoges
dix-neuf rue de la Vige, quatre-vingt-sept, zéro zéro zéro à Limoges
Rue de la Briance, quatre-vingt-sept mille cent dix Bosmie-l'Aiguille
Place Léon Litaud, quatre-vingt-sept, trois cent dix Saint-Laurent-sur-Gorre
Route de la Meyze, Nexon
Route de Limont à Saint-Laurent-sur-Gorre
deux rue du Pont de Nedde
Rue du Clos Gaspard au numéro trois
cinq alléE Maréchal Fayolle, quatre-vingt-sept mille Limoges
trente-quatre rue Docteur Raymond, quatre-vingt-sept, zéro zéro zéro, Limoges
douze passage de Latterie, quatre-vingt-sept, trois cent dix à Saint-Laurent-sur-Gorre
Rue Henri d'Aguesseau, quatre-vingt-sept mille cent soixante-dix Isle
Rue des Marchands de Vin, quatre-vingt-sept, deux cent quatre-vingt-dix Rancon
Avenue Bernard de Ventadour, Oradour-sur-Vayres
Rue Alain Grafeuil à Limoges
sept route du Moulin de la Ribière
Chemin du Château Authier au numéro cinq
cent quatorze BIS avenue Montjovis, quatre-vingt-sept mille Limoges
cent trois route du Mas des Landes, quatre-vingt-sept, cent soixante-dix, Isle
douze rue Pétiniaud-Dubos, quatre-vingt-sept, zéro zéro zéro à Limoges
Impasse des Ruchoux, quatre-vingt-sept mille Limoges
Rue Docteur Desourteaux, quatre-vingt-sept, zéro zéro zéro Limoges
Allée Léopold Gimié, Rilhac-Rancon
Rue de Pouloueix à Oradour-sur-Vayres
soixante-quatre rue Armand Dutreix
Allée de la Vignerie au numéro sept
dix-huit route des Lèzes, quatre-vingt-sept mille cinq cent dix Saint-Jouvent
quatre route de la Croix Sénamaud, quatre-vingt-sept, cinq cent dix, Saint-Jouvent
vingt alléE des Erables, quatre-vingt-sept, zéro zéro zéro à Limoges
Avenue Roland Dorgelès, quatre-vingt-sept mille Limoges
Rue de la Croix de Cramaux, quatre-vingt-sept, deux cents Chaillac-sur-Vienne
Rue des Rosiers Negrelat, Cussac
Rue de l'Aurence à Chaptelat
huit avenue Diogène Bertrand
Route du Dérot au numéro cinquante-cinq
douze rue du Grand Rouvre, quatre-vingt-sept mille quatre cents Royères
soixante-deux avenue de Louyat, quatre-vingt-sept, zéro zéro zéro, Limoges
soixante et un rue de Brouillebas, quatre-vingt-sept, zéro zéro zéro à Limoges
Place Marcelin Berthelot, quatre-vingt-sept mille trois cent cinquante Panazol
Avenue Michel Gondinet, quatre-vingt-sept, cinq cents Saint-Yrieix-la-Perche
Rue d'Arliquet, Aixe-sur-Vienne
Rue Pierre Duditlieu à Bessines-sur-Gartempe
trente et un route d'Aureil
Rue Général du Bessol au numéro trois
un chemin du Moulin de Razès-Bas, quatre-vingt-sept mille six cent quarante Razès
deux impasse de Lasfond, quatre-vingt-sept, cinq cent quatre-vingt-dix, Saint-Just-le-Martel
vingt-sept boulevard du Vigenal, quatre-vingt-sept, zéro zéro zéro à Limoges
Route de la Gaudine, quatre-vingt-sept mille deux cents Saint-Brice-sur-Vienne
Rue de Saint Gence, quatre-vingt-sept, zéro zéro zéro Limoges
Rue des Geoffres, Verneuil-sur-Vienne
Rue du Cercler à Limoges
six route de la Longe
Route de Mouret au numéro neuf
un rue des Ligures, quatre-vingt-sept mille cent dix Le Vigen
vingt-neuf rue Fonvieille-Alquier, quatre-vingt-sept, zéro zéro zéro, Limoges
huit rue du Cramouloux, quatre-vingt-sept, cent dix à Bosmie-l'Aiguille
AlléE des Eglantiers, quatre-vingt-sept mille Limoges
Rue de Fontbouillant, quatre-vingt-sept, six cents Rochechouart
Passage du Caroussel, Feytiat
Avenue du Sablard à Limoges
