deux cent onze BIS rue de la Galave, soixante-cinq mille trois cents Lannemezan
quatre chemin de Cachalet, soixante-cinq, deux cent trente, Castelnau-Magnoac
huit rue de la Graouette, soixante-cinq, trois cent dix à Laloubère
Route de Layrisse, soixante-cinq mille deux cents Loucrup
Rue Cabos, soixante-cinq, cent quarante Rabastens-de-Bigorre
Route de Jarret, Lourdes
Rue de Roquette Buisson à Argelès-Gazost
trente marque Debat
Rue du Nid Bigourdan au numéro neuf
dix-sept rue de Traynès, soixante-cinq mille Tarbes
neuf chemin du Trounc, soixante-cinq, cent, Bartrès
vingt-neuf BIS chemin Clair, soixante-cinq, zéro zéro zéro à Tarbes
Rue de Perseigna, soixante-cinq mille Tarbes
Chemin de Mespoux, soixante-cinq, deux cents Bagnères-de-Bigorre
Place Peyramale, Lourdes
Rue de l'Oussouet à Trébons
douze rue Raymond Peyrès
Chemin de Perdigailh au numéro huit
un impasse de la Geune, soixante-cinq mille deux cent quatre-vingt-dix Juillan
vingt-six TER avenue Claude Chalin, soixante-cinq, cinq cents, Vic-en-Bigorre
dix-neuf place Deras Laças, soixante-cinq, deux cents à Orignac
Rue Charles Manciet, soixante-cinq mille quatre cent vingt Ibos
Rue du Galor, soixante-cinq, trois cent quatre-vingts Orincles
Impasse du Padouen, Bernadets-Debat
Chemin de la Gouniou à Rabastens-de-Bigorre
dix rue de la Bernède
Avenue du Régiment de Bigorre au numéro trente-huit
seize rue du Souy, soixante-cinq mille quatre cent vingt Ibos
vingt-neuf rue François Marquès, soixante-cinq, zéro zéro zéro, Tarbes
huit chemin des Loumagnes, soixante-cinq, deux cent vingt à Bernadets-Debat
Cami de la Serre, soixante-cinq mille trois cent soixante Bernac-Dessus
Rue de Lyouères, soixante-cinq, deux cent quarante Arreau
Hameau Isaby, Pierrefitte-Nestalas
Avenue des Hêtres à Odos
vingt-cinq rue d'Escondeaux
Rue Lanne-Dessus au numéro vingt
neuf rue dets Labats, soixante-cinq mille cent vingt Luz-Saint-Sauveur
deux place Marcadale, soixante-cinq, deux cent vingt, Trie-sur-Baïse
quatre rue Lacrampe Loustau, soixante-cinq, cent quatre-vingt-dix à Tournay
Impasse Urac, soixante-cinq mille quatre cent vingt Ibos
Rue Jean Maumus, soixante-cinq, quatre cent trente Soues
Route de Parabère, Larreule
Impasse Lucie Sarthou à Ossun
vingt-quatre rue de la Hountéte
Lotissement Clairière au numéro quarante-deux
trois chemin de Brousset, soixante-cinq mille trois cent soixante Vielle-Adour
neuf chemin de la Bouderie, soixante-cinq, trois cent vingt, Lagarde
dix rue de Langelle, soixante-cinq, cent à Lourdes
Avenue du Pouey, soixante-cinq mille quatre cent vingt Ibos
Chemin du Buala, soixante-cinq, cent quatre-vingt-dix Hitte
Chemin de Juillan, Azereix
Avenue de Besques à Argelès-Gazost
trente et un route du Marmajou
Route de Cantaous au numéro trente-huit
huit quai de la Neste, soixante-cinq mille deux cent quarante Arreau
soixante-six allées Labarnés, soixante-cinq, sept cents, Maubourguet
douze résidence Array Dou Sou, soixante-cinq, zéro zéro zéro à Tarbes
Rue Capdeville Cathala, soixante-cinq mille cent quatre-vingt-dix Tournay
Rue de Silhac, soixante-cinq, cinq cents Vic-en-Bigorre
Rue de Peyre Crabère, Lourdes
Chemin du Comte Nord à Argelès-Gazost
neuf cent quatre-vingt-dix-huit route de Cannet
Rue du Général Menvielle au numéro trente
cinquante-quatre rue de la Tour d'Oléac, soixante-cinq mille trois cent cinquante Boulin
dix-neuf chemin des Artigaux, soixante-cinq, deux cents, Ordizan
dix-neuf cami de Mességuères, soixante-cinq, trois cent soixante à Bernac-Debat
Rue Lucien Pourxet, soixante-cinq mille cent Lourdes
Rue d'Ossun, soixante-cinq, cent vingt Luz-Saint-Sauveur
Rue des Bavarois, Luz-Saint-Sauveur
Route de Las Poueyes à Aucun
